ID,Título,Precio,Habitaciones,Metros cuadrados,Planta,Comercializado por,Link,Garaje
1304,"Piso en Beteró, València",190.000€,3 hab.,65 m²,planta 1ª exterior sin ascensor,Particular o sin info,https://www.idealista.com/inmueble/107643964/,No incluye garaje
1305,"Piso en Mestalla, València",520.000€,4 hab.,171 m²,planta 1ª exterior con ascensor,Particular o sin info,https://www.idealista.com/inmueble/107691290/,Garaje incluido
1306,"Piso en calle de Linares, Nou Moles, València",505.000€,4 hab.,260 m²,planta 4ª exterior con ascensor,Particular o sin info,https://www.idealista.com/inmueble/106335928/,Garaje incluido
1307,"Piso en Aiora, València",250.000€,2 hab.,75 m²,bajo exterior sin ascensor,Selección Inmobiliaria,https://www.idealista.com/inmueble/105125745/,No incluye garaje
1308,"Piso en calle de Conca, Patraix, València",249.000€,3 hab.,170 m²,bajo exterior con ascensor,Particular o sin info,https://www.idealista.com/inmueble/106820854/,No incluye garaje
1309,"Piso en plaza de Tavernes de Valldigna, El Carme, València",185.000€,2 hab.,91 m²,bajo exterior sin ascensor,Particular o sin info,https://www.idealista.com/inmueble/107237499/,No incluye garaje
1310,"Piso en L'Hort de Senabre, València",200.000€,3 hab.,82 m²,planta 1ª exterior con ascensor,Inmobiliaria Casabella,https://www.idealista.com/inmueble/107390249/,No incluye garaje
1311,"Piso en Playa de la Malvarrosa, València",195.000€,3 hab.,65 m²,planta 4ª exterior sin ascensor,Inmobiliaria Casabella,https://www.idealista.com/inmueble/106067023/,No incluye garaje
1312,"Piso en calle de Na Constança Miquel, Marxalenes, València",143.000€,3 hab.,70 m²,planta 2ª exterior con ascensor,Particular o sin info,https://www.idealista.com/inmueble/107356577/,No incluye garaje
1313,"Piso en calle del Musico Chapí, Fonteta de Sant Lluìs, València",175.000€,1 hab.,51 m²,bajo exterior con ascensor,Particular o sin info,https://www.idealista.com/inmueble/102991096/,No incluye garaje
1314,"Ático en La Xerea, La Xerea, València",650.000€,2 hab.,95 m²,planta 5ª exterior con ascensor,Particular o sin info,https://www.idealista.com/inmueble/106521424/,No incluye garaje
1315,"Piso en calle de Montant, 9, El Cabanyal-El Canyamelar, València",249.800€,2 hab.,72 m²,entreplanta exterior sin ascensor,Particular o sin info,https://www.idealista.com/inmueble/107758770/,No incluye garaje
1316,"Piso en Tormos, València",250.000€,3 hab.,80 m²,planta 1ª exterior sin ascensor,Grupo90 inmobiliarias,https://www.idealista.com/inmueble/103852512/,No incluye garaje
1317,"Dúplex en calle de la Mare de Déu de les Neus, 14, La Xerea, València",370.000€,2 hab.,114 m²,planta 2ª exterior sin ascensor,Particular o sin info,https://www.idealista.com/inmueble/107728588/,No incluye garaje
1318,"Piso en calle del Portal de Valldigna, El Carme, València",185.000€,1 hab.,90 m²,bajo exterior sin ascensor,medina&co,https://www.idealista.com/inmueble/107138712/,No incluye garaje
1319,"Piso en La Petxina, València",260.000€,1 hab.,65 m²,bajo exterior con ascensor,Molmar ',https://www.idealista.com/inmueble/106765767/,No incluye garaje
1320,"Piso en Campanar, València",260.000€,3 hab.,110 m²,bajo exterior con ascensor,Molmar ',https://www.idealista.com/inmueble/106765626/,No incluye garaje
1321,"Piso en Ciutat Jardí, València",319.000€,4 hab.,90 m²,planta 2ª exterior con ascensor,Particular o sin info,https://www.idealista.com/inmueble/107574527/,Garaje incluido
1322,"Piso en Campanar, València",260.000€,3 hab.,110 m²,bajo exterior con ascensor,Molmar ',https://www.idealista.com/inmueble/106765626/,No incluye garaje
1323,"Piso en calle de Rosa Estruch Espinós (política), 10, Tres Forques, València",78.000€,1 hab.,38 m²,bajo exterior sin ascensor,Particular o sin info,https://www.idealista.com/inmueble/107707566/,No incluye garaje
1324,"Piso en La Creu del Grau, València",285.000€,2 hab.,85 m²,planta 1ª interior con ascensor,Particular o sin info,https://www.idealista.com/inmueble/107808704/,No incluye garaje
1325,"Ático en Torrefiel, València",340.000€,3 hab.,100 m²,planta 5ª exterior con ascensor,Realtor Valencia Inmobiliaria,https://www.idealista.com/inmueble/106886974/,Garaje opc. 25.000 €
1326,"Piso en Els Orriols, València",140.000€,2 hab.,66 m²,bajo exterior sin ascensor,REDPISO VALENCIA PRIMADO REIG,https://www.idealista.com/inmueble/107665053/,No incluye garaje
1327,"Piso en calle del Síndic Mojolí, Camí Reial, València",180.000€,3 hab.,78 m²,planta 2ª exterior con ascensor,Particular o sin info,https://www.idealista.com/inmueble/106694326/,No incluye garaje
1328,"Piso en Torrefiel, València",290.000€,4 hab.,110 m²,planta 3ª exterior con ascensor,Molmar ',https://www.idealista.com/inmueble/102667446/,No incluye garaje
1329,"Piso en El Cabanyal-El Canyamelar, València",155.000€,1 hab.,60 m²,bajo exterior sin ascensor,Molmar ',https://www.idealista.com/inmueble/106895777/,No incluye garaje
1330,"Piso en Tres Forques, València",110.000€,2 hab.,65 m²,planta 5ª exterior sin ascensor,Molmar ',https://www.idealista.com/inmueble/106817505/,No incluye garaje
1331,"Piso en Els Orriols, València",110.000€,2 hab.,80 m²,planta 5ª exterior sin ascensor,Percent Servicios Inmobiliarios,https://www.idealista.com/inmueble/107389376/,No incluye garaje
1332,"Piso en Benicalap, València",145.000€,3 hab.,80 m²,planta 1ª exterior con ascensor,Molmar ',https://www.idealista.com/inmueble/106745006/,No incluye garaje
1333,"Piso en calle del Doctor Moliner, 4, Exposició, València",500.000€,3 hab.,80 m²,planta 5ª interior con ascensor,Particular o sin info,https://www.idealista.com/inmueble/107710154/,No incluye garaje
1334,"Piso en Patraix, València",380.000€,3 hab.,117 m²,planta 3ª exterior con ascensor,Lliria invest,https://www.idealista.com/inmueble/105965901/,Garaje incluido
1335,"Ático en marva, 8, Arrancapins, València",510.000€,1 hab.,100 m²,planta 6ª exterior con ascensor,Particular o sin info,https://www.idealista.com/inmueble/107818894/,No incluye garaje
1336,"Piso en El Mercat, València",310.000€,2 hab.,110 m²,bajo exterior con ascensor,Molmar ',https://www.idealista.com/inmueble/106819785/,No incluye garaje
1337,"Piso en El Pla del Remei, València",850.000€,7 hab.,235 m²,planta 6ª con ascensor,Particular o sin info,https://www.idealista.com/inmueble/35640306/,No incluye garaje
1338,"Piso en calle de Tirant lo Blanch, 25, En Corts, València",239.900€,3 hab.,85 m²,planta 1ª exterior sin ascensor,Particular o sin info,https://www.idealista.com/inmueble/106645139/,No incluye garaje
1339,"Piso en calle Felipe de Gauna, 9, El Cabanyal-El Canyamelar, València",290.000€,3 hab.,80 m²,planta 3ª exterior sin ascensor,Particular o sin info,https://www.idealista.com/inmueble/104243596/,No incluye garaje
1340,"Piso en La Llum, València",280.000€,4 hab.,124 m²,planta 1ª exterior con ascensor,Particular o sin info,https://www.idealista.com/inmueble/107435600/,No incluye garaje
1341,"Ático en calle de Guillem de Castro, 61, El Botànic, València",230.000€,1 hab.,27 m²,planta 6ª exterior con ascensor,Particular o sin info,https://www.idealista.com/inmueble/107729532/,No incluye garaje
1342,"Piso en malvarrosa, Playa de la Malvarrosa, València",190.000€,3 hab.,75 m²,planta 3ª exterior sin ascensor,medina&co,https://www.idealista.com/inmueble/106167363/,No incluye garaje
1343,"Chalet adosado en calle de la Reina, 66, El Cabanyal-El Canyamelar, València",800.000€,3 hab.,180 m²,,Particular o sin info,https://www.idealista.com/inmueble/107034257/,No incluye garaje
1344,"Piso en Playa de la Malvarrosa, València",230.000€,2 hab.,78 m²,bajo exterior sin ascensor,REDPISO VALENCIA MALVARROSA,https://www.idealista.com/inmueble/106790112/,No incluye garaje
1345,"Piso en calle de Sant Vicent Màrtir, La Raiosa, València",309.000€,3 hab.,74 m²,planta 2ª exterior con ascensor,Particular o sin info,https://www.idealista.com/inmueble/107542532/,No incluye garaje
1346,"Piso en avenida de la Malva-Rosa, 121, Playa de la Malvarrosa, València",250.000€,1 hab.,40 m²,bajo exterior con ascensor,Particular o sin info,https://www.idealista.com/inmueble/107558050/,No incluye garaje
1347,"Piso en Els Orriols, València",97.000€,3 hab.,59 m²,planta 4ª,SAFTI,https://www.idealista.com/inmueble/107538019/,No incluye garaje
1348,"Estudio en calle de Na Constança Miquel, 4, Marxalenes, València",150.000€,,65 m²,planta 4ª exterior con ascensor,Particular o sin info,https://www.idealista.com/inmueble/106636606/,No incluye garaje
1349,"Piso en avenida del Primat Reig, 59, Els Orriols, València",220.000€,3 hab.,89 m²,planta 3ª exterior con ascensor,Particular o sin info,https://www.idealista.com/inmueble/107342353/,No incluye garaje
1350,"Piso en La Roqueta, València",800.000€,5 hab.,400 m²,planta 6ª exterior con ascensor,Particular o sin info,https://www.idealista.com/inmueble/39174209/,Garaje opc. 40.000 €
1351,"Piso en plaza de Joaquín Dualde, Marxalenes, València",140.000€,2 hab.,53 m²,planta 2ª interior sin ascensor,Grupo Inmobiliario Enmetros,https://www.idealista.com/inmueble/107485224/,No incluye garaje
1352,"Piso en calle del Rei Saud, La Fontsanta, València",130.000€,1 hab.,32 m²,exterior sin ascensor,Particular o sin info,https://www.idealista.com/inmueble/107375835/,No incluye garaje
1353,"Piso en calle de Concha Espina, 4, L'Amistat, València",270.000€,2 hab.,70 m²,planta 3ª exterior con ascensor,Particular o sin info,https://www.idealista.com/inmueble/107810002/,No incluye garaje
1354,"Piso en calle d'Hernán Cortés, 24, El Pla del Remei, València",995.000€,3 hab.,176 m²,planta 5ª exterior con ascensor,Particular o sin info,https://www.idealista.com/inmueble/107801875/,No incluye garaje
1355,"Piso en Sant Francesc, València",850.000€,3 hab.,224 m²,planta 4ª exterior con ascensor,Particular o sin info,https://www.idealista.com/inmueble/35808373/,No incluye garaje
1356,"Piso en Camí Fondo, València",245.000€,4 hab.,121 m²,bajo interior sin ascensor,Particular o sin info,https://www.idealista.com/inmueble/106701683/,No incluye garaje
1357,"Chalet adosado en El Cabanyal-El Canyamelar, València",287.000€,2 hab.,72 m²,,Particular o sin info,https://www.idealista.com/inmueble/106999481/,No incluye garaje
1358,"Piso en calle de Luis Bolinches Compañ, 18, Penya-Roja, València",600.000€,3 hab.,130 m²,planta 4ª exterior con ascensor,Particular o sin info,https://www.idealista.com/inmueble/107420802/,Garaje incluido
1359,"Piso en calle de los Rosales, 23, Benicalap, València",250.000€,5 hab.,161 m²,bajo exterior sin ascensor,Particular o sin info,https://www.idealista.com/inmueble/107296395/,No incluye garaje
1360,"Piso en Cruz Cubierta, s/n, La Creu Coberta, València",110.000€,3 hab.,75 m²,planta 3ª exterior con ascensor,Particular o sin info,https://www.idealista.com/inmueble/107833329/,No incluye garaje
1361,"Piso en L'Illa Perduda, València",300.000€,2 hab.,84 m²,planta 6ª exterior con ascensor,Inmobiliaria Casabella,https://www.idealista.com/inmueble/107726297/,No incluye garaje
1362,"Piso en calle del Professor Ángel Lacalle, 19, Sant Isidre, València",310.000€,3 hab.,121 m²,planta 1ª exterior con ascensor,Particular o sin info,https://www.idealista.com/inmueble/107116699/,Garaje incluido
1363,"Piso en Benimaclet, València",360.000€,3 hab.,115 m²,planta 3ª exterior con ascensor,Particular o sin info,https://www.idealista.com/inmueble/106637135/,Garaje incluido
1364,"Piso en calle de Busot, 8, Patraix, València",280.000€,3 hab.,78 m²,planta 3ª exterior sin ascensor,Particular o sin info,https://www.idealista.com/inmueble/107511983/,No incluye garaje
1365,"Casa o chalet independiente en El Cabanyal-El Canyamelar, València",400.000€,4 hab.,180 m²,,Particular o sin info,https://www.idealista.com/inmueble/107331393/,No incluye garaje
1366,"Piso en calle de Balmes, 3, El Pilar, València",340.000€,2 hab.,80 m²,bajo exterior sin ascensor,Particular o sin info,https://www.idealista.com/inmueble/107601961/,No incluye garaje
1367,"Piso en Tres Forques, València",199.900€,2 hab.,68 m²,planta 1ª exterior con ascensor,Tu mejor llave,https://www.idealista.com/inmueble/107110220/,No incluye garaje
1368,"Piso en Chiva, 23, Patraix, València",315.000€,4 hab.,111 m²,planta 5ª exterior con ascensor,Particular o sin info,https://www.idealista.com/inmueble/107368602/,No incluye garaje
1369,"Piso en calle Benicarló, 38, Trinitat, València",236.000€,3 hab.,94 m²,planta 1ª exterior con ascensor,Particular o sin info,https://www.idealista.com/inmueble/107341073/,No incluye garaje
1370,"Piso en calle de Jaime Beltrán, 8, La Raiosa, València",185.000€,3 hab.,80 m²,planta 4ª exterior sin ascensor,Particular o sin info,https://www.idealista.com/inmueble/107263443/,No incluye garaje
1371,"Piso en carcagente, 14, La Raiosa, València",365.000€,4 hab.,140 m²,planta 5ª exterior con ascensor,Particular o sin info,https://www.idealista.com/inmueble/105919463/,Garaje incluido
1372,"Piso en plaza Cardenal Monescillo, 7, Benicalap, València",150.000€,3 hab.,87 m²,planta 1ª exterior sin ascensor,Particular o sin info,https://www.idealista.com/inmueble/107209279/,No incluye garaje
1373,"Piso en calle del Progrés, 273, El Cabanyal-El Canyamelar, València",659.000€,2 hab.,80 m²,bajo exterior sin ascensor,Particular o sin info,https://www.idealista.com/inmueble/107434223/,No incluye garaje
1374,"Piso en avenida de la Constitució, 30, Morvedre, València",440.000€,2 hab.,100 m²,planta 4ª exterior con ascensor,Particular o sin info,https://www.idealista.com/inmueble/107471857/,No incluye garaje
1375,"Piso en paseo de l'Albereda, 64, Penya-Roja, València",325.000€,1 hab.,52 m²,planta 4ª exterior con ascensor,Particular o sin info,https://www.idealista.com/inmueble/83723432/,Garaje incluido
1376,"Piso en Sant Francesc, València",735.000€,5 hab.,207 m²,planta 2ª exterior con ascensor,Particular o sin info,https://www.idealista.com/inmueble/106445590/,Garaje incluido
1377,"Ático en Arrancapins, València",290.000€,1 hab.,60 m²,planta 5ª exterior con ascensor,Particular o sin info,https://www.idealista.com/inmueble/107267561/,No incluye garaje
1378,"Piso en calle Mestre Palau, El Botànic, València",685.000€,3 hab.,150 m²,planta 3ª exterior con ascensor,Huspy Valencia,https://www.idealista.com/inmueble/107625480/,Garaje incluido
1379,"Piso en calle de Sant Rafael, Playa de la Malvarrosa, València",240.000€,3 hab.,111 m²,planta 2ª exterior con ascensor,Huspy Valencia,https://www.idealista.com/inmueble/107689326/,No incluye garaje
1380,"Piso en calle del Doctor Moliner, Exposició, València",680.000€,4 hab.,209 m²,planta 5ª exterior con ascensor,Huspy Valencia,https://www.idealista.com/inmueble/107689446/,Garaje incluido
1381,"Chalet adosado en avenida de Gaspar Aguilar, La Raiosa, València",550.000€,6 hab.,241 m²,,Huspy Valencia,https://www.idealista.com/inmueble/106675190/,No incluye garaje
1382,"Piso en calle d'Hernández Lázaro, Nou Campanar, València",610.000€,3 hab.,158 m²,planta 4ª exterior con ascensor,Huspy Valencia,https://www.idealista.com/inmueble/107059047/,Garaje incluido
1383,"Piso en avenida del Mestre Rodrigo, Sant Pau, València",409.000€,3 hab.,119 m²,planta 3ª exterior con ascensor,Huspy Valencia,https://www.idealista.com/inmueble/107457663/,Garaje incluido
1384,"Piso en Sant Francesc, Sant Francesc, València",390.000€,3 hab.,99 m²,planta 12ª interior con ascensor,Particular o sin info,https://www.idealista.com/inmueble/107826411/,No incluye garaje
1385,"Piso en avenida de les Balears, Penya-Roja, València",550.000€,3 hab.,117 m²,planta 6ª exterior con ascensor,Engel & Völkers València,https://www.idealista.com/inmueble/107790944/,Garaje incluido
1386,"Piso en avenida del General Avilés, Benicalap, València",385.000€,3 hab.,128 m²,planta 8ª exterior con ascensor,HogarAbitat,https://www.idealista.com/inmueble/107519865/,Garaje incluido
1387,"Piso en calle de Fuerteventura, Playa de la Malvarrosa, València",190.000€,3 hab.,79 m²,planta 4ª exterior sin ascensor,HogarAbitat,https://www.idealista.com/inmueble/106317812/,No incluye garaje
1388,"Piso en avenida del Marqués de Sotelo, Sant Francesc, València",925.000€,3 hab.,238 m²,planta 2ª exterior con ascensor,Engel & Völkers València,https://www.idealista.com/inmueble/107221996/,No incluye garaje
1389,"Piso en calle de Buenos Aires, Russafa, València",695.000€,2 hab.,129 m²,bajo exterior sin ascensor,Engel & Völkers València,https://www.idealista.com/inmueble/105402463/,No incluye garaje
1390,"Piso en calle dels Gremis, 7 -1, Vara de Quart, València",210.000€,1 hab.,99 m²,planta 3ª exterior con ascensor,Kasabiba,https://www.idealista.com/inmueble/106560163/,Garaje incluido
1391,"Piso en calle Poeta Querol, Sant Francesc, València",1.600.000€,6 hab.,356 m²,planta 2ª exterior con ascensor,Pilar Fuster Inmobiliaria,https://www.idealista.com/inmueble/100815743/,Garaje opc. 60.000 €
1392,"Piso en Gran Via del Marqués del Túria, El Pla del Remei, València",975.000€,4 hab.,234 m²,planta 7ª exterior con ascensor,Pilar Fuster Inmobiliaria,https://www.idealista.com/inmueble/105927590/,No incluye garaje
1393,"Piso en calle del Poeta Querol, Sant Francesc, València",980.000€,3 hab.,208 m²,planta 6ª exterior con ascensor,Desirée Hato gestion de inmuebles,https://www.idealista.com/inmueble/106030222/,No incluye garaje
1394,"Piso en calle d'Oriola, Morvedre, València",250.000€,3 hab.,88 m²,planta 1ª exterior sin ascensor,HogarAbitat,https://www.idealista.com/inmueble/107566256/,No incluye garaje
1395,"Piso en calle de Colón, El Pla del Remei, València",850.000€,3 hab.,222 m²,planta 6ª exterior con ascensor,Pilar Fuster Inmobiliaria,https://www.idealista.com/inmueble/103702169/,Garaje opc. 50.000 €
1396,"Piso en Marqués sotelo, Sant Francesc, València",850.000€,5 hab.,240 m²,planta 2ª exterior con ascensor,Pilar Fuster Inmobiliaria,https://www.idealista.com/inmueble/103502749/,No incluye garaje
1397,"Piso en calle Vilaragut, Sant Francesc, València",990.000€,3 hab.,212 m²,planta 4ª exterior con ascensor,Pilar Fuster Inmobiliaria,https://www.idealista.com/inmueble/98103179/,No incluye garaje
1398,"Piso en calle de Vicente Beltrán Grimal, La Creu del Grau, València",384.000€,3 hab.,115 m²,planta 2ª exterior con ascensor,Particular o sin info,https://www.idealista.com/inmueble/106506993/,Garaje incluido
1399,"Piso en calle d'Amadeo Roca, 3, Penya-Roja, València",1.200.000€,5 hab.,175 m²,exterior con ascensor,Century21 Liberty Home,https://www.idealista.com/inmueble/103067171/,Garaje incluido
1400,"Piso en avenida de Blasco Ibáñez, Exposició, València",725.000€,3 hab.,141 m²,planta 15ª exterior con ascensor,Found Valencia Real Estate,https://www.idealista.com/inmueble/106676414/,Garaje incluido
1401,"Ático en calle del Convent de Jerusalem, La Roqueta, València",280.000€,2 hab.,52 m²,planta 5ª exterior con ascensor,Everest Consultores,https://www.idealista.com/inmueble/107788798/,No incluye garaje
1402,"Dúplex en calle del Poeta Josep Cervera i Grífol, 12, Ciutat de les Arts i de les Ciencies, València",440.000€,3 hab.,108 m²,planta 6ª exterior con ascensor,Studeco World SL,https://www.idealista.com/inmueble/107663588/,Garaje incluido
1403,"Piso en calle de Ciscar, s/n, Gran Vía, València",350.000€,4 hab.,128 m²,planta 4ª exterior con ascensor,Particular o sin info,https://www.idealista.com/inmueble/104177481/,No incluye garaje
1404,"Piso en calle de Borrull, El Botànic, València",330.000€,1 hab.,126 m²,planta 1ª exterior con ascensor,RACASA TORRES DE QUART,https://www.idealista.com/inmueble/107352982/,No incluye garaje
1405,"Piso en El Cabanyal-El Canyamelar, València",330.000€,3 hab.,135 m²,planta 6ª exterior con ascensor,Inmocity,https://www.idealista.com/inmueble/107382282/,No incluye garaje
1406,"Chalet adosado en calle de lo Rat Penat, Camí Fondo, València",650.000€,5 hab.,170 m²,,Inmobiliaria Patacona. Registro de Agentes  de Intermediación Inmobiliaria  de la Comunidad Valenciana  (RAICV) nº 4066,https://www.idealista.com/inmueble/39359416/,No incluye garaje
1407,"Piso en Gran Vía Marqués del Turia, El Pla del Remei, València",1.250.000€,4 hab.,234 m²,planta 7ª exterior con ascensor,Grupo Amboss,https://www.idealista.com/inmueble/102655540/,No incluye garaje
1408,"Piso en calle del Comte de Salvatierra, El Pla del Remei, València",3.500.000€,4 hab.,352 m²,planta 5ª exterior con ascensor,Grupo Amboss,https://www.idealista.com/inmueble/105204408/,No incluye garaje
1409,"Piso en calle del Pervindre, En Corts, València",369.000€,2 hab.,100 m²,bajo exterior sin ascensor,PRIMER GRUPO Blasco,https://www.idealista.com/inmueble/106981913/,No incluye garaje
1410,"Piso en Joan Baptiste Muñoz, 8, Penya-Roja, València",640.000€,3 hab.,101 m²,bajo exterior con ascensor,Geido Homes,https://www.idealista.com/inmueble/104610702/,No incluye garaje
1411,"Piso en calle d'Albacete, Arrancapins, València",930.000€,5 hab.,232 m²,planta 2ª exterior con ascensor,SPACES AND PLACES,https://www.idealista.com/inmueble/105802155/,Garaje opc. 30.000 €
1412,"Piso en calle del Pintor Genaro Lahuerta, Trinitat, València",612.000€,4 hab.,195 m²,planta 3ª exterior con ascensor,InmoVecinos real estate,https://www.idealista.com/inmueble/105534597/,No incluye garaje
1413,"Piso en Joan Baptiste Muñoz, 8, Penya-Roja, València",640.000€,3 hab.,101 m²,bajo exterior con ascensor,Geido Homes,https://www.idealista.com/inmueble/104610702/,No incluye garaje
1414,"Piso en calle de la Marina Alta, Sant Pau, València",790.000€,5 hab.,204 m²,planta 1ª exterior con ascensor,Alfa Mislata,https://www.idealista.com/inmueble/103349282/,Garaje incluido
1415,"Dúplex en calle de Xàtiva, La Roqueta, València",850.000€,3 hab.,186 m²,planta 6ª exterior con ascensor,Realrent,https://www.idealista.com/inmueble/106230940/,Garaje opc. 50.000 €
1416,"Piso en calle d'Albacete, Arrancapins, València",490.000€,4 hab.,177 m²,planta 2ª exterior con ascensor,Casetes inmobiliaria,https://www.idealista.com/inmueble/107048766/,No incluye garaje
1417,"Piso en avenida d'Amado Granell Mesado, Ciutat de les Arts i de les Ciencies, València",360.000€,2 hab.,91 m²,planta 3ª exterior con ascensor,Particular o sin info,https://www.idealista.com/inmueble/107617248/,Garaje opc. 30.000 €
1418,"Piso en Torrefiel, València",255.000€,2 hab.,89 m²,planta 1ª exterior con ascensor,Particular o sin info,https://www.idealista.com/inmueble/105934373/,Garaje incluido
1419,"Piso en avenida de les Corts Valencianes, Sant Pau, València",915.000€,3 hab.,130 m²,planta 4ª exterior con ascensor,Particular o sin info,https://www.idealista.com/inmueble/107190233/,Garaje incluido
1420,"Piso en calle d'Antonio Ferrandis, Ciutat de les Arts i de les Ciencies, València",690.000€,4 hab.,155 m²,planta 4ª exterior con ascensor,Pisos de Valencia,https://www.idealista.com/inmueble/107247568/,Garaje incluido
1421,"Piso en calle d'Escalante, El Grau, València",357.000€,3 hab.,132 m²,planta 1ª interior con ascensor,Particular o sin info,https://www.idealista.com/inmueble/106254632/,No incluye garaje
1422,"Piso en calle de Don Juan de Austria, Sant Francesc, València",240.000€,1 hab.,49 m²,planta 3ª interior con ascensor,InmoPEOPLE,https://www.idealista.com/inmueble/106803645/,No incluye garaje
1423,"Piso en avenida del Regne de València, Russafa, València",800.000€,3 hab.,134 m²,planta 6ª exterior con ascensor,Particular o sin info,https://www.idealista.com/inmueble/106662057/,No incluye garaje
1424,"Piso en avenida de Blasco Ibáñez, La Carrasca, València",399.000€,3 hab.,110 m²,planta 3ª exterior con ascensor,Particular o sin info,https://www.idealista.com/inmueble/106653539/,No incluye garaje
1425,"Piso en Gran Via de les Germanies, Russafa, València",445.000€,3 hab.,118 m²,planta 5ª exterior con ascensor,Engel & Völkers València,https://www.idealista.com/inmueble/107795400/,Garaje opc. 70.000 €
1426,"Piso en La Creu del Grau, València",214.000€,1 hab.,58 m²,planta 2ª exterior con ascensor,Particular o sin info,https://www.idealista.com/inmueble/106506965/,Garaje incluido
1427,"Ático en avenida del Mestre Rodrigo, Campanar, València",550.000€,4 hab.,210 m²,planta 8ª exterior con ascensor,Particular o sin info,https://www.idealista.com/inmueble/105005224/,Garaje incluido
1428,"Ático en Joan Baptiste Muñoz, 8, Penya-Roja, València",1.300.000€,3 hab.,121 m²,planta 7ª exterior con ascensor,Geido Homes,https://www.idealista.com/inmueble/104652530/,No incluye garaje
1429,"Piso en avenida de Jacinto Benavente, Gran Vía, València",1.300.000€,6 hab.,234 m²,planta 6ª exterior con ascensor,Particular o sin info,https://www.idealista.com/inmueble/106972151/,Garaje incluido
1430,"Piso en avenida de Giorgeta, Arrancapins, València",220.000€,2 hab.,85 m²,planta 7ª exterior con ascensor,Particular o sin info,https://www.idealista.com/inmueble/106943492/,No incluye garaje
1431,"Piso en Joan Baptiste Muñoz, 8, Penya-Roja, València",490.000€,2 hab.,75 m²,planta 2ª exterior con ascensor,Geido Homes,https://www.idealista.com/inmueble/104058854/,No incluye garaje
1432,"Piso en calle del Pare Ferrís, Les Tendetes, València",165.000€,4 hab.,89 m²,planta 3ª exterior sin ascensor,Particular o sin info,https://www.idealista.com/inmueble/107736137/,No incluye garaje
1433,"Piso en calle de las Navas de Tolosa, Tormos, València",230.000€,3 hab.,82 m²,bajo exterior sin ascensor,Particular o sin info,https://www.idealista.com/inmueble/106631646/,No incluye garaje
