ID,Título,Precio,Habitaciones,Metros cuadrados,Planta,Comercializado por,Link,Garaje
784,"Piso en Els Orriols, Els Orriols, València",150.000€,2 hab.,65 m²,planta 2ª exterior sin ascensor,FGESTION,https://www.idealista.com/inmueble/107799447/,No incluye garaje
785,"Piso en calle de Escalante, El Cabanyal-El Canyamelar, València",259.000€,3 hab.,79 m²,planta 4ª exterior con ascensor,Particular o sin info,https://www.idealista.com/inmueble/107464936/,No incluye garaje
786,"Piso en calle del Doctor Josep Juan Dómine, El Grau, València",498.000€,5 hab.,181 m²,planta 4ª exterior con ascensor,Lodan Care S.L,https://www.idealista.com/inmueble/106011823/,No incluye garaje
787,"Piso en calle de Josep Benlliure, 310, El Cabanyal-El Canyamelar, València",395.000€,4 hab.,160 m²,bajo exterior sin ascensor,Particular o sin info,https://www.idealista.com/inmueble/107662496/,No incluye garaje
788,"Piso en calle de Mossèn Planelles, 18, El Cabanyal-El Canyamelar, València",245.000€,2 hab.,75 m²,planta 2ª exterior sin ascensor,ES VALENCIA Real Estate,https://www.idealista.com/inmueble/105294594/,No incluye garaje
789,"Piso en calle del Pintor Dalmau, s/n, Beteró, València",209.000€,3 hab.,73 m²,planta 1ª exterior sin ascensor,Particular o sin info,https://www.idealista.com/inmueble/107532165/,No incluye garaje
790,"Piso en calle de Colón, El Pla del Remei, València",1.200.000€,4 hab.,275 m²,planta 4ª exterior con ascensor,HELICE Inmobiliaria,https://www.idealista.com/inmueble/107135974/,Garaje opc. 60.000 €
791,"Piso en Les Tendetes, València",309.000€,6 hab.,101 m²,bajo exterior sin ascensor,Leader Real Estate,https://www.idealista.com/inmueble/107742327/,No incluye garaje
792,"Piso en calle dels Lleons, Aiora, València",220.000€,1 hab.,50 m²,bajo exterior con ascensor,Particular o sin info,https://www.idealista.com/inmueble/107754854/,No incluye garaje
793,"Piso en avenida del Cid, Patraix, València",490.000€,6 hab.,175 m²,planta 7ª exterior con ascensor,UTANDE Real Estate,https://www.idealista.com/inmueble/107740347/,No incluye garaje
794,"Ático en calle de Moratín, 11, Sant Francesc, València",249.000€,1 hab.,41 m²,planta 7ª exterior con ascensor,ES VALENCIA Real Estate,https://www.idealista.com/inmueble/104592259/,No incluye garaje
795,"Piso en calle de Josep de Saragossa, Barrio de Favara, València",174.500€,1 hab.,59 m²,bajo exterior sin ascensor,LION CAPITAL GROUP,https://www.idealista.com/inmueble/106812918/,No incluye garaje
796,"Estudio en calle de Rodrigo de Pertegás, La Creu del Grau, València",189.000€,,36 m²,bajo exterior con ascensor,Sky Real Estate - Valencia,https://www.idealista.com/inmueble/107740753/,No incluye garaje
797,"Piso en calle dels Lleons, Aiora, València",220.000€,1 hab.,50 m²,bajo exterior con ascensor,Punto Ciudad de Valencia S.L.,https://www.idealista.com/inmueble/107765628/,No incluye garaje
798,"Ático en calle de Llanera de Ranes, 11, L'Hort de Senabre, València",260.000€,2 hab.,75 m²,planta 5ª exterior con ascensor,Comprarcasa Reference,https://www.idealista.com/inmueble/106630160/,No incluye garaje
799,"Piso en calle de Colón, Sant Francesc, València",1.300.000€,4 hab.,184 m²,planta 2ª exterior con ascensor,OC HABITAT,https://www.idealista.com/inmueble/104849112/,No incluye garaje
800,"Piso en calle del Poeta Mas y Ros, Ciutat Jardí, València",339.000€,3 hab.,110 m²,planta 1ª exterior con ascensor,Punto Ciudad de Valencia S.L.,https://www.idealista.com/inmueble/107740729/,No incluye garaje
801,"Piso en calle de Colón, El Pla del Remei, València",1.150.000€,4 hab.,209 m²,planta 4ª exterior con ascensor,HELICE Inmobiliaria,https://www.idealista.com/inmueble/107127618/,Garaje opc. 50.000 €
802,"Piso en avenida de les Corts Valencianes, Sant Pau, València",630.000€,4 hab.,160 m²,planta 3ª exterior con ascensor,KLONOWSKI,https://www.idealista.com/inmueble/105419541/,Garaje incluido
803,"Piso en calle del Comte d'Almenara, El Cabanyal-El Canyamelar, València",185.000€,3 hab.,63 m²,planta 3ª exterior sin ascensor,RE/MAX Urbe ll,https://www.idealista.com/inmueble/107825154/,No incluye garaje
804,"Piso en calle del Riu Escalona, Camí Fondo, València",169.000€,3 hab.,65 m²,bajo exterior sin ascensor,Particular o sin info,https://www.idealista.com/inmueble/107734938/,No incluye garaje
805,"Piso en calle dels Vivons, Russafa, València",290.000€,2 hab.,88 m²,bajo exterior sin ascensor,HELICE Inmobiliaria,https://www.idealista.com/inmueble/105965344/,No incluye garaje
806,"Ático en calle del Doctor Gil i Morte, 17, Arrancapins, València",390.000€,2 hab.,91 m²,planta 7ª exterior con ascensor,Particular o sin info,https://www.idealista.com/inmueble/107843290/,No incluye garaje
807,"Piso en calle del Doctor Josep Juan Dómine, El Grau, València",498.000€,5 hab.,181 m²,planta 4ª exterior con ascensor,esgal inmuebles,https://www.idealista.com/inmueble/105450544/,No incluye garaje
808,"Ático en paseo de l'Albereda, Penya-Roja, València",850.000€,4 hab.,185 m²,planta 10ª exterior con ascensor,Cicerone Group,https://www.idealista.com/inmueble/105258974/,Garaje incluido
809,"Piso en avenida del General Avilés, Benicalap, València",385.000€,3 hab.,127 m²,planta 8ª exterior con ascensor,HogarAbitat Castellón,https://www.idealista.com/inmueble/107501645/,Garaje incluido
810,"Piso en avenida d'Amado Granell Mesado, 35, Mont-Olivet, València",255.000€,3 hab.,92 m²,planta 2ª exterior con ascensor,Lodan Care S.L,https://www.idealista.com/inmueble/107811245/,No incluye garaje
811,"Piso en calle d'Oriola, Morvedre, València",250.000€,3 hab.,89 m²,planta 1ª exterior sin ascensor,HogarAbitat Castellón,https://www.idealista.com/inmueble/107543511/,No incluye garaje
812,"Piso en calle del Bany dels Pavesos, La Seu, València",500.000€,2 hab.,60 m²,bajo exterior sin ascensor,rksirval,https://www.idealista.com/inmueble/107059888/,No incluye garaje
813,"Ático en calle Tejedores, El Pilar, València",190.000€,1 hab.,40 m²,planta 4ª exterior sin ascensor,RE/MAX Urbe ll,https://www.idealista.com/inmueble/107568092/,No incluye garaje
814,"Piso en Benimaclet, València",379.000€,4 hab.,150 m²,planta 2ª exterior con ascensor,Particular o sin info,https://www.idealista.com/inmueble/107557509/,No incluye garaje
815,"Ático en La Roqueta, València",890.000€,4 hab.,320 m²,planta 3ª exterior con ascensor,Particular o sin info,https://www.idealista.com/inmueble/107566939/,No incluye garaje
816,"Ático en avenida de la Malva-Rosa, 124, Playa de la Malvarrosa, València",229.000€,3 hab.,64 m²,planta 1ª exterior sin ascensor,Particular o sin info,https://www.idealista.com/inmueble/107841872/,No incluye garaje
817,"Piso en pio 12, Campanar, València",515.000€,4 hab.,280 m²,planta 1ª exterior con ascensor,Cicerone Group,https://www.idealista.com/inmueble/97930565/,Garaje incluido
818,"Piso en Passatge de Ripalda, 20 --2, Sant Francesc, València",1.195.000€,4 hab.,230 m²,planta 3ª exterior con ascensor,Particular o sin info,https://www.idealista.com/inmueble/107284830/,Garaje opc. 50.000 €
819,"Piso en calle de Pizarro, El Pla del Remei, València",890.000€,5 hab.,248 m²,planta 4ª exterior con ascensor,Cuenca Mirasol asesores inmobiliarios,https://www.idealista.com/inmueble/107730220/,Garaje incluido
820,"Piso en avenida d'Amado Granell Mesado, 35, Mont-Olivet, València",255.000€,3 hab.,92 m²,planta 2ª exterior con ascensor,Lodan Care S.L,https://www.idealista.com/inmueble/107811245/,No incluye garaje
821,"Piso en calle de Sant Vicent Màrtir, 82, Sant Francesc, València",1.095.000€,4 hab.,275 m²,planta 6ª exterior con ascensor,Particular o sin info,https://www.idealista.com/inmueble/105049805/,No incluye garaje
822,"Ático en paseo de l'Albereda, Penya-Roja, València",850.000€,4 hab.,185 m²,planta 10ª exterior con ascensor,Cicerone Group,https://www.idealista.com/inmueble/105258974/,Garaje incluido
823,"Piso en avenida del General Avilés, Benicalap, València",385.000€,3 hab.,127 m²,planta 8ª exterior con ascensor,HogarAbitat Castellón,https://www.idealista.com/inmueble/107501645/,Garaje incluido
824,"Piso en avenida de la Malva-Rosa, Playa de la Malvarrosa, València",205.000€,2 hab.,66 m²,planta 4ª exterior con ascensor,Inmobiliaria serrería,https://www.idealista.com/inmueble/103330791/,No incluye garaje
825,"Piso en avenida de Campanar, 8, El Calvari, València",430.000€,3 hab.,149 m²,planta 1ª exterior con ascensor,Particular o sin info,https://www.idealista.com/inmueble/107838791/,No incluye garaje
826,"Piso en calle de les Illes Canàries, Camí Fondo, València",179.000€,3 hab.,72 m²,planta 4ª exterior sin ascensor,TEMPOCASA,https://www.idealista.com/inmueble/107584293/,No incluye garaje
827,"Piso en calle de Ciril Amorós, 1, El Pla del Remei, València",650.000€,2 hab.,105 m²,planta 6ª exterior con ascensor,Particular o sin info,https://www.idealista.com/inmueble/107130114/,No incluye garaje
828,"Piso en calle de Félix Pizcueta, El Pla del Remei, València",475.000€,2 hab.,105 m²,planta 4ª exterior con ascensor,Solid Inmuebles,https://www.idealista.com/inmueble/105014670/,No incluye garaje
829,"Piso en calle del Comte d'Altea, Gran Vía, València",760.000€,3 hab.,110 m²,planta 3ª exterior con ascensor,Desirée Hato gestion de inmuebles,https://www.idealista.com/inmueble/106102273/,Garaje incluido
830,"Ático en Gran Via de les Germanies, Russafa, València",690.000€,3 hab.,114 m²,planta 8ª exterior con ascensor,Genteurbana,https://www.idealista.com/inmueble/106568338/,No incluye garaje
831,"Piso en calle del Marí Sirera, El Cabanyal-El Canyamelar, València",334.900€,3 hab.,135 m²,planta 6ª exterior con ascensor,Particular o sin info,https://www.idealista.com/inmueble/107705659/,No incluye garaje
832,"Piso en calle Borrull, El Botànic, València",260.000€,2 hab.,66 m²,planta 1ª exterior con ascensor,"DOMÉNECH Y ASOCIADOS, S.C.",https://www.idealista.com/inmueble/90292385/,No incluye garaje
833,"Piso en avenida d'Ausiàs March, Malilla, València",240.000€,3 hab.,85 m²,planta 3ª exterior con ascensor,enboga servicios inmobiliarios,https://www.idealista.com/inmueble/107727512/,No incluye garaje
834,"Ático en avenida del Professor López Piñero, Ciutat de les Arts i de les Ciencies, València",1.290.000€,2 hab.,134 m²,planta 19ª exterior con ascensor,GRUPO APEX REAL ESTATE,https://www.idealista.com/inmueble/107820095/,Garaje incluido
835,"Ático en paseo de l'Albereda, Penya-Roja, València",1.450.000€,5 hab.,330 m²,planta 10ª exterior con ascensor,Gestión Fácil,https://www.idealista.com/inmueble/106850263/,Garaje incluido
836,"Piso en calle de Sant Vicent Màrtir, La Raiosa, València",375.000€,2 hab.,80 m²,planta 9ª exterior con ascensor,Selección Inmobiliaria,https://www.idealista.com/inmueble/99800168/,No incluye garaje
837,"Piso en calle del Pare Viñas, Els Orriols, València",150.000€,2 hab.,55 m²,planta 2ª exterior sin ascensor,Vista Real,https://www.idealista.com/inmueble/107815614/,No incluye garaje
838,"Piso en avenida del Port, Albors, València",680.000€,4 hab.,125 m²,bajo exterior con ascensor,Renturia Soluciones Inmobiliarias,https://www.idealista.com/inmueble/103926619/,No incluye garaje
839,"Piso en avenida San José Artesano, 22, Ciutat Fallera, València",169.000€,3 hab.,69 m²,planta 5ª exterior sin ascensor,Particular o sin info,https://www.idealista.com/inmueble/107830635/,No incluye garaje
840,"Piso en Morvedre, València",380.000€,1 hab.,100 m²,bajo exterior sin ascensor,Agencia Mediterránea,https://www.idealista.com/inmueble/107256320/,No incluye garaje
841,"Piso en Russafa, València",398.000€,3 hab.,138 m²,planta 3ª exterior con ascensor,Agencia Mediterránea,https://www.idealista.com/inmueble/107778431/,No incluye garaje
842,"Piso en calle de la Garrofa, La Xerea, València",1.615.000€,3 hab.,201 m²,planta -1 exterior con ascensor,Particular o sin info,https://www.idealista.com/inmueble/107703638/,Garaje incluido
843,"Ático en Partida Pouet, Nou Campanar, València",830.000€,5 hab.,214 m²,planta 9ª exterior con ascensor,Particular o sin info,https://www.idealista.com/inmueble/105880753/,Garaje opc. 25.000 €
844,"Piso en calle la Salud, La Seu, València",300.000€,2 hab.,68 m²,planta 1ª exterior sin ascensor,Particular o sin info,https://www.idealista.com/inmueble/96696113/,No incluye garaje
845,"Piso en calle del Pare Viñas, Els Orriols, València",150.000€,2 hab.,55 m²,planta 2ª exterior sin ascensor,Vista Real,https://www.idealista.com/inmueble/107815614/,No incluye garaje
846,"Piso en calle de Pere Cabanes, 17, Torrefiel, València",154.000€,1 hab.,54 m²,bajo exterior sin ascensor,My Blue Bricks,https://www.idealista.com/inmueble/107531531/,No incluye garaje
847,"Piso en avenida del Port, Albors, València",680.000€,4 hab.,125 m²,bajo exterior con ascensor,Renturia Soluciones Inmobiliarias,https://www.idealista.com/inmueble/103926619/,No incluye garaje
848,"Piso en calle de Roger de Flor, El Pilar, València",420.000€,4 hab.,114 m²,planta 3ª exterior con ascensor,Inmobiliaria Habitale el Carmen,https://www.idealista.com/inmueble/107488308/,No incluye garaje
849,"Piso en camino de Montcada, Torrefiel, València",185.000€,3 hab.,110 m²,planta 1ª interior con ascensor,RE/MAX Urbe ll,https://www.idealista.com/inmueble/107333927/,No incluye garaje
850,"Piso en avenida d'Ausiàs March, Fonteta de Sant Lluìs, València",270.000€,3 hab.,102 m²,planta 4ª exterior con ascensor,Galgo Real Estate Valencia,https://www.idealista.com/inmueble/107692275/,No incluye garaje
851,"Piso en Malilla, València",275.000€,3 hab.,95 m²,planta 3ª exterior con ascensor,Agencia Mediterránea,https://www.idealista.com/inmueble/107807569/,Garaje incluido
852,"Piso en Morvedre, València",380.000€,1 hab.,100 m²,bajo exterior sin ascensor,Agencia Mediterránea,https://www.idealista.com/inmueble/107256320/,No incluye garaje
853,"Piso en calle de Pere Cabanes, 17, Torrefiel, València",145.000€,1 hab.,52 m²,bajo exterior sin ascensor,My Blue Bricks,https://www.idealista.com/inmueble/106589334/,No incluye garaje
854,"Piso en calle dels Sants Just i Pastor, Aiora, València",360.000€,3 hab.,135 m²,planta 2ª exterior con ascensor,Particular o sin info,https://www.idealista.com/inmueble/106814827/,No incluye garaje
855,"Piso en El Botànic, València",385.000€,2 hab.,80 m²,planta 3ª exterior con ascensor,Inmobiliaria El Porvenir,https://www.idealista.com/inmueble/105465622/,No incluye garaje
856,"Piso en calle de Peris Mencheta, Benimaclet, València",325.000€,4 hab.,111 m²,planta 2ª exterior con ascensor,Particular o sin info,https://www.idealista.com/inmueble/107836593/,No incluye garaje
857,"Piso en calle de Pere Cabanes, 17, Torrefiel, València",155.000€,1 hab.,44 m²,bajo exterior sin ascensor,My Blue Bricks,https://www.idealista.com/inmueble/107144136/,No incluye garaje
858,"Piso en calle del Duc de Gaeta, 36, Aiora, València",220.000€,3 hab.,85 m²,planta 7ª exterior con ascensor,Particular o sin info,https://www.idealista.com/inmueble/107841784/,No incluye garaje
859,"Ático en calle de les Monges, El Mercat, València",365.000€,2 hab.,105 m²,planta 4ª exterior con ascensor,Valentasa Consultores,https://www.idealista.com/inmueble/107124908/,No incluye garaje
860,"Piso en calle del Riu Escalona, Camí Fondo, València",350.000€,5 hab.,104 m²,planta 2ª exterior con ascensor,Punto Ciudad de Valencia S.L.,https://www.idealista.com/inmueble/107836634/,No incluye garaje
861,"Piso en avenida del Regne de València, Gran Vía, València",569.000€,3 hab.,111 m²,planta 4ª exterior con ascensor,Valentasa Consultores,https://www.idealista.com/inmueble/106565628/,No incluye garaje
862,"Piso en avenida d'Aragó, Mestalla, València",1.100.000€,4 hab.,182 m²,planta 5ª exterior con ascensor,Punto Ciudad de Valencia S.L.,https://www.idealista.com/inmueble/107833857/,Garaje incluido
863,"Ático en calle de Vicente Raga, Penya-Roja, València",1.190.000€,3 hab.,175 m²,planta 11ª exterior con ascensor,JJ Inmobiliaria,https://www.idealista.com/inmueble/106928926/,Garaje incluido
864,"Piso en calle del Pare Viñas, Els Orriols, València",150.000€,2 hab.,60 m²,planta 2ª exterior sin ascensor,RACASA MARVÁ,https://www.idealista.com/inmueble/107835228/,No incluye garaje
865,"Piso en calle de José Aguilar, Aiora, València",320.000€,2 hab.,80 m²,bajo exterior sin ascensor,Particular o sin info,https://www.idealista.com/inmueble/106999080/,No incluye garaje
866,"Piso en calle D'Alberic, Arrancapins, València",670.000€,3 hab.,150 m²,bajo exterior sin ascensor,PINEDA LUXURY,https://www.idealista.com/inmueble/104835550/,No incluye garaje
867,"Ático en calle Obispo Don Jerónimo, El Carme, València",289.000€,2 hab.,105 m²,planta 5ª exterior sin ascensor,Lodan Care S.L,https://www.idealista.com/inmueble/96184935/,No incluye garaje
868,"Piso en avenida de les Balears, Penya-Roja, València",365.000€,3 hab.,95 m²,planta 8ª interior con ascensor,Punto Ciudad de Valencia S.L.,https://www.idealista.com/inmueble/105251986/,Garaje incluido
869,"Dúplex en calle Andarella, Vara de Quart, València",230.000€,1 hab.,140 m²,planta 4ª exterior con ascensor,Mocadi Real Estate,https://www.idealista.com/inmueble/106329645/,Garaje incluido
870,"Piso en calle de Trafalgar, Penya-Roja, València",585.000€,3 hab.,122 m²,planta 3ª exterior con ascensor,Inmobiliaria Trafalgar,https://www.idealista.com/inmueble/107449333/,No incluye garaje
871,"Piso en calle del Riu Escalona, Camí Fondo, València",350.000€,5 hab.,104 m²,planta 2ª exterior con ascensor,Punto Ciudad de Valencia S.L.,https://www.idealista.com/inmueble/107836634/,No incluye garaje
872,"Piso en calle D'Alberic, Arrancapins, València",670.000€,3 hab.,150 m²,bajo exterior sin ascensor,PINEDA LUXURY,https://www.idealista.com/inmueble/104835550/,No incluye garaje
873,"Piso en calle de Trafalgar, Penya-Roja, València",585.000€,3 hab.,122 m²,planta 3ª exterior con ascensor,Inmobiliaria Trafalgar,https://www.idealista.com/inmueble/107449333/,No incluye garaje
874,"Piso en avenida d'Aragó, Mestalla, València",1.100.000€,4 hab.,182 m²,planta 5ª exterior con ascensor,Punto Ciudad de Valencia S.L.,https://www.idealista.com/inmueble/107833857/,Garaje incluido
875,"Casa o chalet independiente en Entrada Oliva, La Punta, València",210.000€,3 hab.,250 m²,,Century21 Liberty Home,https://www.idealista.com/inmueble/107809250/,No incluye garaje
876,"Dúplex en calle de na Jordana, El Carme, València",670.000€,3 hab.,195 m²,planta 1ª exterior con ascensor,Lodan Care S.L,https://www.idealista.com/inmueble/101882645/,No incluye garaje
877,"Piso en avenida de les Corts Valencianes, Benicalap, València",521.900€,2 hab.,100 m²,planta 22ª exterior con ascensor,NOV REAL ESTATE,https://www.idealista.com/inmueble/107520012/,Garaje incluido
878,"Piso en calle de Navellos, La Seu, València",795.000€,5 hab.,177 m²,planta 4ª exterior con ascensor,Ûrbanites Inmobiliaria,https://www.idealista.com/inmueble/107528106/,No incluye garaje
879,"Piso en calle de l'Arxiduc Carles, Vara de Quart, València",250.000€,4 hab.,103 m²,planta 1ª exterior con ascensor,Particular o sin info,https://www.idealista.com/inmueble/107826035/,No incluye garaje
880,"Piso en avenida del Mestre Rodrigo, Sant Pau, València",470.000€,3 hab.,135 m²,planta 6ª exterior con ascensor,Malach Real Estate,https://www.idealista.com/inmueble/107237537/,Garaje incluido
881,"Piso en plaza de Sant Agustí, 3, Sant Francesc, València",390.000€,3 hab.,99 m²,planta 12ª interior con ascensor,Particular o sin info,https://www.idealista.com/inmueble/107718574/,No incluye garaje
882,"Piso en calle d'Isabel la Catòlica, El Pla del Remei, València",2.100.000€,5 hab.,350 m²,exterior con ascensor,Huspy Valencia,https://www.idealista.com/inmueble/107223329/,No incluye garaje
883,"Piso en calle de la Florista, Benicalap, València",215.000€,1 hab.,56 m²,planta 1ª exterior con ascensor,HERITAGE PATRIMONIAL,https://www.idealista.com/inmueble/107424214/,No incluye garaje
884,"Piso en calle de Lluís de Santàngel, Russafa, València",600.000€,3 hab.,149 m²,planta 1ª exterior sin ascensor,Huspy Valencia,https://www.idealista.com/inmueble/107353539/,No incluye garaje
885,"Casa o chalet independiente en calle d'Eugènia Viñes, El Cabanyal-El Canyamelar, València",1.440.000€,6 hab.,365 m²,,Malach Real Estate,https://www.idealista.com/inmueble/107318744/,Garaje incluido
886,"Piso en calle de Peris Mencheta, Benimaclet, València",325.000€,4 hab.,111 m²,planta 2ª exterior con ascensor,Punto Ciudad de Valencia S.L.,https://www.idealista.com/inmueble/107820316/,No incluye garaje
887,"Piso en calle dels Soguers, El Carme, València",400.000€,3 hab.,180 m²,planta 1ª exterior con ascensor,Particular o sin info,https://www.idealista.com/inmueble/107139723/,No incluye garaje
888,"Piso en calle de José Aguilar, Aiora, València",320.000€,2 hab.,80 m²,bajo exterior sin ascensor,Punto Ciudad de Valencia S.L.,https://www.idealista.com/inmueble/107029434/,No incluye garaje
889,"Estudio en calle d'Alcanyís, Torrefiel, València",135.000€,,48 m²,bajo exterior con ascensor,Particular o sin info,https://www.idealista.com/inmueble/107329688/,No incluye garaje
890,"Piso en plaza de l'Ajuntament, Sant Francesc, València",1.200.000€,4 hab.,230 m²,planta 3ª exterior con ascensor,Cassea Inmobiliaria,https://www.idealista.com/inmueble/107213578/,Garaje opc. 50.000 €
891,"Piso en calle dels Sants Just i Pastor, Aiora, València",360.000€,3 hab.,135 m²,planta 2ª exterior con ascensor,Punto Ciudad de Valencia S.L.,https://www.idealista.com/inmueble/106865863/,No incluye garaje
892,"Piso en Arrancapins, València",530.000€,5 hab.,143 m²,planta 2ª exterior con ascensor,Percent Servicios Inmobiliarios,https://www.idealista.com/inmueble/104952193/,No incluye garaje
893,"Casa o chalet independiente en calle del Riu Tajo, Playa de la Malvarrosa, València",990.000€,6 hab.,260 m²,,Malach Real Estate,https://www.idealista.com/inmueble/107785008/,No incluye garaje
894,"Piso en calle de Joan Llorenç, La Petxina, València",470.000€,5 hab.,170 m²,planta 6ª exterior con ascensor,Gestión Fácil,https://www.idealista.com/inmueble/107111687/,Garaje incluido
895,"Piso en calle d'Antoni Suárez, Mestalla, València",520.000€,2 hab.,151 m²,planta 9ª exterior con ascensor,TEMPOCASA,https://www.idealista.com/inmueble/107045285/,No incluye garaje
896,"Casa o chalet independiente en calle del Pare Lluís Navarro, El Cabanyal-El Canyamelar, València",565.000€,4 hab.,190 m²,,enboga servicios inmobiliarios,https://www.idealista.com/inmueble/107344548/,No incluye garaje
897,"Piso en avenida del Cardenal Benlloch, Albors, València",390.000€,4 hab.,127 m²,planta 6ª exterior con ascensor,TEMPOCASA,https://www.idealista.com/inmueble/105171400/,Garaje incluido
898,"Piso en avenida de les Balears, Penya-Roja, València",590.000€,4 hab.,137 m²,planta 6ª exterior con ascensor,TEMPOCASA,https://www.idealista.com/inmueble/106654951/,No incluye garaje
899,"Piso en avenida del Regne de València, Gran Vía, València",339.800€,3 hab.,84 m²,planta 7ª interior con ascensor,Particular o sin info,https://www.idealista.com/inmueble/106780304/,No incluye garaje
900,"Piso en calle de Xile, Mestalla, València",460.000€,3 hab.,102 m²,planta 3ª exterior con ascensor,UrbanHome,https://www.idealista.com/inmueble/106809224/,Garaje incluido
901,"Casa o chalet independiente en calle del Pare Lluís Navarro, El Cabanyal-El Canyamelar, València",565.000€,4 hab.,190 m²,,enboga servicios inmobiliarios,https://www.idealista.com/inmueble/107344548/,No incluye garaje
902,"Piso en avenida del Regne de València, Gran Vía, València",339.800€,3 hab.,84 m²,planta 7ª interior con ascensor,Particular o sin info,https://www.idealista.com/inmueble/106780304/,No incluye garaje
903,"Piso en calle de Sant Vicent Màrtir, Arrancapins, València",800.000€,3 hab.,165 m²,planta 2ª exterior con ascensor,Particular o sin info,https://www.idealista.com/inmueble/107068968/,Garaje incluido
904,"Piso en calle de Montesa, Barrio de Favara, València",275.000€,5 hab.,112 m²,planta 1ª exterior con ascensor,Francisca Mayor Gestión Inmobiliaria,https://www.idealista.com/inmueble/106582819/,No incluye garaje
905,"Casa o chalet independiente en Av. de Gaspar Aguilar, Barrio de Favara, València",430.000€,5 hab.,265 m²,,ASKA INMOBILIARIA Patraix,https://www.idealista.com/inmueble/103098118/,Garaje incluido
906,"Piso en avenida del Cardenal Benlloch, Albors, València",390.000€,4 hab.,127 m²,planta 6ª exterior con ascensor,TEMPOCASA,https://www.idealista.com/inmueble/105171400/,Garaje incluido
907,"Piso en calle del Pintor Dalmau, Beteró, València",209.000€,3 hab.,73 m²,planta 1ª exterior sin ascensor,Punto Ciudad de Valencia S.L.,https://www.idealista.com/inmueble/107487824/,No incluye garaje
908,"Piso en calle de Félix Pizcueta, El Pla del Remei, València",475.000€,2 hab.,105 m²,planta 4ª exterior con ascensor,Galgo Real Estate Valencia,https://www.idealista.com/inmueble/105157029/,No incluye garaje
909,"Piso en calle de Pascual i Genís, Sant Francesc, València",225.000€,1 hab.,43 m²,planta 4ª interior con ascensor,RK Igarka,https://www.idealista.com/inmueble/101829287/,No incluye garaje
910,"Piso en plaza de tetuán, La Xerea, València",925.000€,4 hab.,189 m²,planta 2ª exterior con ascensor,Particular o sin info,https://www.idealista.com/inmueble/36769048/,No incluye garaje
