ID,Título,Precio,Habitaciones,Metros cuadrados,Planta,Comercializado por,Link,Garaje
1,"Piso en calle del Poeta Querol, 7, Sant Francesc, València",1.350.000€,3 hab.,236 m²,planta 6ª exterior con ascensor,LION CAPITAL GROUP,https://www.idealista.com/inmueble/107552311/,Garaje incluido
2,"Piso en calle de Navellos, La Seu, València",1.050.000€,3 hab.,188 m²,planta 2ª exterior con ascensor,Engel & Völkers València,https://www.idealista.com/inmueble/107048311/,No incluye garaje
3,"Piso en calle del Poeta Querol, Sant Francesc, València",1.350.000€,3 hab.,236 m²,planta 6ª exterior con ascensor,Engel & Völkers València,https://www.idealista.com/inmueble/106614759/,Garaje incluido
4,"Piso en calle de Navellos, La Seu, València",1.050.000€,3 hab.,188 m²,planta 2ª exterior con ascensor,LION CAPITAL GROUP,https://www.idealista.com/inmueble/107311950/,No incluye garaje
5,"Ático en calle Guillem de Castro, La Roqueta, València",890.000€,4 hab.,320 m²,planta 5ª exterior con ascensor,LION CAPITAL GROUP,https://www.idealista.com/inmueble/104109291/,No incluye garaje
6,"Piso en avenida de María Cristina, El Mercat, València",430.000€,2 hab.,100 m²,planta 2ª exterior con ascensor,LION CAPITAL GROUP,https://www.idealista.com/inmueble/107124247/,No incluye garaje
7,"Piso en calle de Guillem de Castro, La Roqueta, València",864.000€,3 hab.,149 m²,planta 5ª exterior con ascensor,Engel & Völkers València,https://www.idealista.com/inmueble/106620603/,No incluye garaje
8,"Piso en calle de Vicent Sancho Tello, Mestalla, València",730.000€,5 hab.,212 m²,planta 1ª exterior con ascensor,LION CAPITAL GROUP,https://www.idealista.com/inmueble/107635362/,No incluye garaje
9,"Piso en calle de Marvà, Arrancapins, València",530.000€,5 hab.,143 m²,planta 2ª exterior con ascensor,LION CAPITAL GROUP,https://www.idealista.com/inmueble/107768677/,No incluye garaje
10,"Piso en calle de Jesús, Arrancapins, València",695.000€,4 hab.,150 m²,planta 5ª exterior con ascensor,LION CAPITAL GROUP,https://www.idealista.com/inmueble/107724842/,Garaje incluido
11,"Piso en plaza de Sant Agustí, Sant Francesc, València",1.600.000€,4 hab.,201 m²,planta 7ª exterior con ascensor,LION CAPITAL GROUP,https://www.idealista.com/inmueble/107114324/,No incluye garaje
12,"Piso en calle de Colón, Sant Francesc, València",1.150.000€,4 hab.,228 m²,planta 3ª exterior con ascensor,LION CAPITAL GROUP,https://www.idealista.com/inmueble/106205310/,Garaje incluido
13,"Piso en calle de Ribera, Sant Francesc, València",650.000€,4 hab.,168 m²,planta 4ª exterior con ascensor,LION CAPITAL GROUP,https://www.idealista.com/inmueble/104971359/,Garaje opc. 42.000 €
14,"Ático en calle de Guillem de Castro, La Roqueta, València",890.000€,4 hab.,320 m²,planta 5ª exterior con ascensor,Engel & Völkers València,https://www.idealista.com/inmueble/101024517/,No incluye garaje
15,"Piso en La Xerea, València",1.450.000€,5 hab.,207 m²,planta 5ª exterior con ascensor,LION CAPITAL GROUP,https://www.idealista.com/inmueble/106337149/,No incluye garaje
16,"Piso en avenida del Marqués de Sotelo, Sant Francesc, València",1.300.000€,3 hab.,254 m²,planta 3ª exterior con ascensor,Engel & Völkers València,https://www.idealista.com/inmueble/104743376/,No incluye garaje
17,"Piso en calle de Vinatea, El Pilar, València",435.000€,2 hab.,100 m²,planta 1ª exterior con ascensor,Engel & Völkers València,https://www.idealista.com/inmueble/107651247/,No incluye garaje
18,"Ático en calle del Comte de Montornés, La Xerea, València",1.780.000€,3 hab.,180 m²,planta 4ª exterior con ascensor,Engel & Völkers València,https://www.idealista.com/inmueble/103167562/,Garaje opc. 50.000 €
19,"Piso en calle de Navellos, La Seu, València",1.050.000€,3 hab.,188 m²,planta 2ª exterior con ascensor,aProperties Real Estate Valencia,https://www.idealista.com/inmueble/107019683/,No incluye garaje
20,"Dúplex en calle del Doctor Monserrat, El Botànic, València",750.000€,3 hab.,240 m²,bajo exterior con ascensor,LION CAPITAL GROUP,https://www.idealista.com/inmueble/106096291/,No incluye garaje
21,"Ático en calle del Forn de l'Hospital, El Pilar, València",399.000€,2 hab.,119 m²,planta 3ª exterior con ascensor,LION CAPITAL GROUP,https://www.idealista.com/inmueble/106663801/,Garaje opc. 25.000 €
22,"Piso en calle El Pilar, El Pilar, València",435.000€,2 hab.,100 m²,planta 1ª exterior con ascensor,LION CAPITAL GROUP,https://www.idealista.com/inmueble/107114978/,No incluye garaje
23,"Piso en El Pla del Remei, València",1.350.000€,5 hab.,273 m²,planta 4ª exterior con ascensor,Engel & Völkers València,https://www.idealista.com/inmueble/106677284/,Garaje incluido
24,"Dúplex en El Pilar, València",475.000€,3 hab.,132 m²,planta 1ª exterior con ascensor,LION CAPITAL GROUP,https://www.idealista.com/inmueble/106603813/,No incluye garaje
25,"Piso en El Pla del Remei, València",1.350.000€,5 hab.,273 m²,planta 4ª exterior con ascensor,Person Inmobiliaria,https://www.idealista.com/inmueble/106620181/,Garaje incluido
26,"Dúplex en La Petxina, València",670.000€,3 hab.,167 m²,bajo exterior sin ascensor,Person Inmobiliaria,https://www.idealista.com/inmueble/106880064/,No incluye garaje
27,"Piso en calle de Colón, Sant Francesc, València",1.300.000€,4 hab.,212 m²,planta 2ª exterior con ascensor,LION CAPITAL GROUP,https://www.idealista.com/inmueble/103479633/,No incluye garaje
28,"Piso en calle de les Garrigues, Sant Francesc, València",1.000.000€,4 hab.,235 m²,planta 5ª exterior con ascensor,LION CAPITAL GROUP,https://www.idealista.com/inmueble/106992762/,No incluye garaje
29,"Piso en calle del Músic Peydró, El Mercat, València",450.000€,3 hab.,75 m²,planta 2ª exterior sin ascensor,LION CAPITAL GROUP,https://www.idealista.com/inmueble/107533915/,No incluye garaje
30,"Piso en calle de Salamanca, Gran Vía, València",550.000€,5 hab.,158 m²,planta 2ª exterior con ascensor,CALLAGHAN inmobiliaria,https://www.idealista.com/inmueble/107448065/,Garaje opc. 50.000 €
31,"Piso en calle del Museu, El Carme, València",270.000€,2 hab.,70 m²,planta 3ª exterior sin ascensor,LION CAPITAL GROUP,https://www.idealista.com/inmueble/107748373/,No incluye garaje
32,"Piso en Arrancapins, València",690.000€,3 hab.,379 m²,bajo interior con ascensor,aProperties Real Estate Valencia,https://www.idealista.com/inmueble/104551154/,No incluye garaje
33,"Piso en avenida de Jacinto Benavente, Gran Vía, València",1.300.000€,6 hab.,234 m²,planta 6ª exterior con ascensor,Engel & Völkers València,https://www.idealista.com/inmueble/107060002/,Garaje incluido
34,"Piso en avenida de l'Oest, Sant Francesc, València",890.000€,5 hab.,303 m²,planta 2ª exterior con ascensor,CALLAGHAN inmobiliaria,https://www.idealista.com/inmueble/105464738/,No incluye garaje
35,"Ático en El Mercat, València",480.000€,2 hab.,85 m²,exterior con ascensor,aProperties Real Estate Valencia,https://www.idealista.com/inmueble/107053324/,No incluye garaje
36,"Piso en avenida del Marqués de Sotelo, Sant Francesc, València",1.300.000€,3 hab.,254 m²,planta 3ª exterior sin ascensor,Lucas Fox Valencia,https://www.idealista.com/inmueble/104450784/,No incluye garaje
37,"Piso en calle de Sant Vicent Màrtir, Sant Francesc, València",1.350.000€,5 hab.,349 m²,planta 3ª exterior con ascensor,Engel & Völkers València,https://www.idealista.com/inmueble/104478532/,No incluye garaje
38,"Piso en calle de Ribera, Sant Francesc, València",680.000€,4 hab.,118 m²,planta 6ª exterior con ascensor,LION CAPITAL GROUP,https://www.idealista.com/inmueble/107836243/,No incluye garaje
39,"Piso en El Carme, València",400.000€,4 hab.,126 m²,planta 1ª exterior con ascensor,aProperties Real Estate Valencia,https://www.idealista.com/inmueble/107490635/,No incluye garaje
40,"Piso en calle de Joaquín Costa, Gran Vía, València",605.000€,6 hab.,190 m²,planta 1ª exterior con ascensor,CALLAGHAN inmobiliaria,https://www.idealista.com/inmueble/107473665/,No incluye garaje
41,"Piso en avenida de Jacinto Benavente, Gran Vía, València",725.000€,4 hab.,179 m²,planta 1ª exterior con ascensor,CALLAGHAN inmobiliaria,https://www.idealista.com/inmueble/107529377/,No incluye garaje
42,"Piso en Arrancapins, València",695.000€,4 hab.,150 m²,planta 5ª exterior con ascensor,aProperties Real Estate Valencia,https://www.idealista.com/inmueble/107189689/,Garaje incluido
43,"Piso en calle de Russafa, 19, El Pla del Remei, València",875.000€,5 hab.,228 m²,planta 2ª exterior con ascensor,HELICE Inmobiliaria,https://www.idealista.com/inmueble/107605412/,No incluye garaje
44,"Piso en calle de Sant Vicent Màrtir, Sant Francesc, València",1.350.000€,4 hab.,240 m²,planta 6ª exterior con ascensor,CALLAGHAN inmobiliaria,https://www.idealista.com/inmueble/107502163/,No incluye garaje
45,"Piso en Russafa, València",615.000€,3 hab.,117 m²,planta 6ª exterior con ascensor,donpiso,https://www.idealista.com/inmueble/107711196/,No incluye garaje
46,"Piso en avenida del Marqués de Sotelo, 9, Sant Francesc, València",1.300.000€,3 hab.,254 m²,planta 3ª exterior con ascensor,HELICE Inmobiliaria,https://www.idealista.com/inmueble/107475749/,No incluye garaje
47,"Piso en Sant Francesc, València",1.075.000€,3 hab.,194 m²,planta 3ª exterior sin ascensor,Lucas Fox Valencia,https://www.idealista.com/inmueble/107360054/,No incluye garaje
48,"Piso en Sant Francesc, València",1.075.000€,8 hab.,342 m²,planta 2ª exterior con ascensor,Lucas Fox Valencia,https://www.idealista.com/inmueble/107627360/,No incluye garaje
49,"Piso en calle del Poeta Querol, s/n, Sant Francesc, València",900.000€,4 hab.,210 m²,planta 3ª exterior con ascensor,Coldwell Banker Excellence Real Estate,https://www.idealista.com/inmueble/107584098/,No incluye garaje
50,"Piso en calle de Cadis, Russafa, València",750.000€,3 hab.,130 m²,planta 3ª exterior con ascensor,HELICE Inmobiliaria,https://www.idealista.com/inmueble/104983712/,No incluye garaje
51,"Piso en avenida de Suècia, Mestalla, València",510.000€,3 hab.,130 m²,planta 2ª exterior con ascensor,Malach Real Estate,https://www.idealista.com/inmueble/107069876/,No incluye garaje
52,"Ático en avenida del Professor López Piñero, Ciutat de les Arts i de les Ciencies, València",1.290.000€,2 hab.,134 m²,planta 19ª exterior con ascensor,LION CAPITAL GROUP,https://www.idealista.com/inmueble/107670158/,Garaje incluido
53,"Dúplex en avenida de Blasco Ibáñez, Ciutat Jardí, València",771.000€,3 hab.,255 m²,planta 19ª exterior con ascensor,LION CAPITAL GROUP,https://www.idealista.com/inmueble/107760697/,Garaje incluido
54,"Piso en calle del Bomber Ramon Duart, Ciutat de les Arts i de les Ciencies, València",750.000€,3 hab.,126 m²,planta 8ª exterior con ascensor,LION CAPITAL GROUP,https://www.idealista.com/inmueble/107669024/,Garaje incluido
55,"Piso en avenida del Primat Reig, Els Orriols, València",300.000€,4 hab.,130 m²,planta 8ª exterior con ascensor,CALLAGHAN inmobiliaria,https://www.idealista.com/inmueble/107776316/,Garaje opc. 25.000 €
56,"Dúplex en avenida de Francia, Penya-Roja, València",1.340.000€,6 hab.,368 m²,planta 11ª exterior con ascensor,LION CAPITAL GROUP,https://www.idealista.com/inmueble/103929737/,Garaje incluido
57,"Dúplex en calle d'Isabel de Villena, 31, Playa de la Malvarrosa, València",1.260.000€,4 hab.,191 m²,bajo exterior con ascensor,Monserrate inmobiliaria,https://www.idealista.com/inmueble/107169566/,Garaje incluido
58,"Ático en avenida de les Corts Valencianes, 26, Benicalap, València",1.400.000€,3 hab.,177 m²,planta 14ª exterior con ascensor,Monserrate inmobiliaria,https://www.idealista.com/inmueble/107501040/,Garaje incluido
59,"Piso en calle de Guillem de Castro, La Roqueta, València",865.000€,3 hab.,149 m²,planta 5ª exterior con ascensor,Monserrate inmobiliaria,https://www.idealista.com/inmueble/106633237/,No incluye garaje
60,"Piso en calle de Luis Bolinches Compañ, Penya-Roja, València",560.000€,3 hab.,138 m²,planta 2ª exterior con ascensor,LION CAPITAL GROUP,https://www.idealista.com/inmueble/107825387/,Garaje opc. 40.000 €
61,"Ático en calle Andarella, 2, Vara de Quart, València",390.000€,2 hab.,300 m²,planta 5ª exterior con ascensor,Kasabiba,https://www.idealista.com/inmueble/107600722/,No incluye garaje
62,"Piso en calle dels Gremis, 7 -1, Vara de Quart, València",195.000€,1 hab.,110 m²,planta 1ª exterior con ascensor,Kasabiba,https://www.idealista.com/inmueble/107768527/,Garaje incluido
63,"Dúplex en calle de Trafalgar, 53, Penya-Roja, València",790.000€,4 hab.,220 m²,planta 7ª exterior con ascensor,LION CAPITAL GROUP,https://www.idealista.com/inmueble/104441262/,Garaje incluido
64,"Piso en calle del Doctor Josep Juan Dómine, El Grau, València",498.000€,5 hab.,181 m²,exterior con ascensor,Engel & Völkers València,https://www.idealista.com/inmueble/105731411/,No incluye garaje
65,"Ático en calle dels Gremis, 7, Vara de Quart, València",230.000€,1 hab.,147 m²,planta 4ª exterior con ascensor,Kasabiba,https://www.idealista.com/inmueble/105815938/,Garaje incluido
66,"Piso en calle dels Gremis, 7 ----1, Vara de Quart, València",189.000€,1 hab.,114 m²,planta 1ª exterior con ascensor,Kasabiba,https://www.idealista.com/inmueble/105448714/,Garaje incluido
67,"Piso en Lopez Piñero, Ciutat de les Arts i de les Ciencies, València",650.000€,3 hab.,127 m²,planta 13ª exterior con ascensor,LION CAPITAL GROUP,https://www.idealista.com/inmueble/103771127/,Garaje incluido
68,"Piso en calle de Guillem de Castro, Sant Francesc, València",650.000€,6 hab.,231 m²,planta 4ª exterior con ascensor,Engel & Völkers València,https://www.idealista.com/inmueble/106417316/,No incluye garaje
69,"Dúplex en calle Isabel de Villena, Playa de la Malvarrosa, València",798.000€,4 hab.,190 m²,bajo exterior sin ascensor,ILIOS Real Estate,https://www.idealista.com/inmueble/99977200/,Garaje incluido
70,"Dúplex en avenida de França, Penya-Roja, València",1.340.000€,6 hab.,368 m²,planta 12ª exterior con ascensor,INMOAROA,https://www.idealista.com/inmueble/100153353/,Garaje incluido
71,"Piso en Ciutat de les Arts i de les Ciencies, València",420.000€,2 hab.,91 m²,planta 14ª exterior con ascensor,Engel & Völkers València,https://www.idealista.com/inmueble/106858878/,Garaje opc. 30.000 €
72,"Ático en calle de la Marina Alta, Sant Pau, València",1.195.000€,3 hab.,324 m²,planta 5ª exterior con ascensor,aProperties Real Estate Valencia,https://www.idealista.com/inmueble/106632448/,Garaje incluido
73,"Dúplex en avenida de les Corts Valencianes, Sant Pau, València",750.000€,4 hab.,156 m²,planta 11ª exterior con ascensor,LION CAPITAL GROUP,https://www.idealista.com/inmueble/107738455/,Garaje incluido
74,"Piso en plaza de la Reina, La Seu, València",1.050.000€,4 hab.,218 m²,planta 3ª exterior con ascensor,Engel & Völkers València,https://www.idealista.com/inmueble/100890567/,No incluye garaje
75,"Piso en calle de Buenos Aires, Russafa, València",495.000€,2 hab.,82 m²,planta 3ª exterior con ascensor,Engel & Völkers València,https://www.idealista.com/inmueble/105402465/,No incluye garaje
76,"Piso en calle de Guillem de Castro, El Pilar, València",550.000€,4 hab.,133 m²,planta 8ª exterior con ascensor,CM PROPERTIES REAL ESTATE  VALENCIA,https://www.idealista.com/inmueble/106182996/,Garaje opc. 49.000 €
77,"Piso en calle de Colón, Sant Francesc, València",1.300.000€,4 hab.,184 m²,planta 2ª exterior con ascensor,aProperties Real Estate Valencia,https://www.idealista.com/inmueble/105437158/,No incluye garaje
78,"Piso en camino del Cabanyal, Beteró, València",319.000€,2 hab.,94 m²,planta 6ª exterior con ascensor,LION CAPITAL GROUP,https://www.idealista.com/inmueble/106701685/,No incluye garaje
79,"Ático en paseo de l'Albereda, Penya-Roja, València",1.450.000€,5 hab.,220 m²,planta 10ª exterior con ascensor,LION CAPITAL GROUP,https://www.idealista.com/inmueble/107170366/,Garaje incluido
80,"Piso en avenida de les Balears, Penya-Roja, València",590.000€,4 hab.,137 m²,planta 6ª exterior con ascensor,LION CAPITAL GROUP,https://www.idealista.com/inmueble/107010735/,Garaje opc. 35.000 €
81,"Piso en calle d'Alcanyís, Torrefiel, València",185.000€,2 hab.,138 m²,bajo exterior sin ascensor,LION CAPITAL GROUP,https://www.idealista.com/inmueble/107114559/,No incluye garaje
82,"Piso en calle del General Palanca, La Xerea, València",812.000€,3 hab.,208 m²,planta 5ª exterior con ascensor,LION CAPITAL GROUP,https://www.idealista.com/inmueble/105306561/,No incluye garaje
83,"Piso en calle de Vicente Ríos Enrique, Nou Campanar, València",599.000€,4 hab.,165 m²,planta 3ª exterior con ascensor,LION CAPITAL GROUP,https://www.idealista.com/inmueble/105753533/,Garaje incluido
84,"Piso en calle de Lluís Oliag, Mont-Olivet, València",590.000€,4 hab.,169 m²,planta 1ª exterior con ascensor,Engel & Völkers València,https://www.idealista.com/inmueble/106898788/,No incluye garaje
85,"Piso en avenida de les Corts Valencianes, Sant Pau, València",1.125.000€,3 hab.,225 m²,planta 15ª exterior con ascensor,INMOAROA,https://www.idealista.com/inmueble/104392000/,Garaje incluido
86,"Piso en calle del Bomber Ramon Duart, Ciutat de les Arts i de les Ciencies, València",750.000€,3 hab.,134 m²,planta 8ª exterior con ascensor,CALLAGHAN inmobiliaria,https://www.idealista.com/inmueble/105361085/,Garaje incluido
87,"Piso en Mont-Olivet, València",590.000€,4 hab.,169 m²,planta 1ª exterior con ascensor,Lucas Fox Valencia,https://www.idealista.com/inmueble/106865745/,No incluye garaje
88,"Piso en calle del Comte de Salvatierra, 6, El Pla del Remei, València",1.100.000€,5 hab.,241 m²,planta 3ª exterior con ascensor,Pilar Fuster Inmobiliaria,https://www.idealista.com/inmueble/104858982/,Garaje incluido
89,"Piso en calle dels Gremis, Vara de Quart, València",169.900€,1 hab.,114 m²,planta 4ª exterior con ascensor,Kasabiba,https://www.idealista.com/inmueble/106651368/,Garaje incluido
90,"Dúplex en calle dels Tomasos, 20, Russafa, València",1.100.000€,5 hab.,317 m²,bajo exterior sin ascensor,Monserrate inmobiliaria,https://www.idealista.com/inmueble/96126297/,No incluye garaje
91,"Piso en calle del Pare Jofré, La Roqueta, València",325.000€,2 hab.,42 m²,bajo exterior sin ascensor,aProperties Real Estate Valencia,https://www.idealista.com/inmueble/104242821/,No incluye garaje
92,"Piso en En Corts, València",410.000€,3 hab.,103 m²,planta 1ª exterior con ascensor,Engel & Völkers València,https://www.idealista.com/inmueble/106982744/,No incluye garaje
93,"Dúplex en Campanar, València",549.000€,2 hab.,129 m²,planta 5ª exterior con ascensor,Person Inmobiliaria,https://www.idealista.com/inmueble/105885675/,Garaje incluido
94,"Piso en En Corts, València",410.000€,3 hab.,103 m²,planta 1ª exterior con ascensor,aProperties Real Estate Valencia,https://www.idealista.com/inmueble/106824816/,No incluye garaje
95,"Piso en Russafa, València",1.100.000€,4 hab.,287 m²,planta 2ª exterior con ascensor,Person Inmobiliaria,https://www.idealista.com/inmueble/107651065/,No incluye garaje
96,"Piso en avenida del Marqués de Sotelo, Sant Francesc, València",1.300.000€,3 hab.,225 m²,planta 3ª exterior con ascensor,Monserrate inmobiliaria,https://www.idealista.com/inmueble/103875321/,No incluye garaje
97,"Casa o chalet independiente en En Corts, València",985.000€,3 hab.,177 m²,,LION CAPITAL GROUP,https://www.idealista.com/inmueble/106538850/,Garaje incluido
98,"Piso en Mont-Olivet, València",725.000€,4 hab.,129 m²,planta 7ª exterior con ascensor,Lucas Fox Valencia,https://www.idealista.com/inmueble/106997037/,No incluye garaje
99,"Chalet adosado en En Corts, València",985.000€,3 hab.,177 m²,,Engel & Völkers València,https://www.idealista.com/inmueble/104919984/,Garaje incluido
100,"Piso en Ciutat de les Arts i de les Ciencies, València",850.000€,3 hab.,186 m²,planta 14ª exterior con ascensor,Engel & Völkers València,https://www.idealista.com/inmueble/106406877/,Garaje incluido
101,"Piso en El Pilar, València",645.000€,4 hab.,136 m²,planta 6ª exterior con ascensor,Lucas Fox Valencia,https://www.idealista.com/inmueble/103955251/,No incluye garaje
102,"Piso en La Xerea, València",435.000€,2 hab.,104 m²,planta 2ª exterior con ascensor,LION CAPITAL GROUP,https://www.idealista.com/inmueble/107838304/,No incluye garaje
103,"Piso en Sant Francesc, València",835.000€,4 hab.,151 m²,planta 6ª exterior con ascensor,Lucas Fox Valencia,https://www.idealista.com/inmueble/105616462/,No incluye garaje
104,"Piso en Russafa, València",530.000€,3 hab.,139 m²,planta 6ª exterior con ascensor,Person Inmobiliaria,https://www.idealista.com/inmueble/107256786/,No incluye garaje
105,"Ático en Nou Campanar, València",830.000€,5 hab.,214 m²,planta 9ª exterior con ascensor,aProperties Real Estate Valencia,https://www.idealista.com/inmueble/105420125/,Garaje incluido
106,"Piso en Sant Pau, València",915.000€,3 hab.,134 m²,planta 4ª exterior con ascensor,aProperties Real Estate Valencia,https://www.idealista.com/inmueble/106329307/,Garaje incluido
107,"Piso en Benimaclet, València",550.000€,4 hab.,202 m²,planta 3ª exterior con ascensor,aProperties Real Estate Valencia,https://www.idealista.com/inmueble/105262788/,Garaje incluido
108,"Piso en plaza de Tetuan, La Xerea, València",925.000€,3 hab.,189 m²,planta 2ª exterior con ascensor,Desirée Hato gestion de inmuebles,https://www.idealista.com/inmueble/104959416/,No incluye garaje
109,"Piso en calle d'Albacete, Arrancapins, València",440.000€,4 hab.,162 m²,bajo exterior con ascensor,Desirée Hato gestion de inmuebles,https://www.idealista.com/inmueble/106556188/,No incluye garaje
110,"Piso en plaza Pintor Vidal Corella, 2, Playa de la Malvarrosa, València",319.900€,3 hab.,87 m²,bajo exterior con ascensor,Inmobiliaria Patacona. Registro de Agentes  de Intermediación Inmobiliaria  de la Comunidad Valenciana  (RAICV) nº 4066,https://www.idealista.com/inmueble/100112303/,No incluye garaje
111,"Piso en calle dels Gremis, Vara de Quart, València",199.000€,1 hab.,99 m²,planta 3ª exterior con ascensor,Kasabiba,https://www.idealista.com/inmueble/106685859/,Garaje incluido
112,"Piso en calle d'Estubeny, Benicalap, València",142.000€,3 hab.,68 m²,planta 3ª exterior sin ascensor,LION CAPITAL GROUP,https://www.idealista.com/inmueble/107638217/,No incluye garaje
113,"Piso en avenida de Burjassot, Marxalenes, València",185.000€,3 hab.,74 m²,planta 7ª interior con ascensor,LION CAPITAL GROUP,https://www.idealista.com/inmueble/107754160/,No incluye garaje
114,"Piso en avenida del Regne de València, Russafa, València",429.000€,4 hab.,130 m²,planta 4ª exterior con ascensor,Kasabiba,https://www.idealista.com/inmueble/107123119/,No incluye garaje
115,"Ático en avenida del Professor López Piñero, Ciutat de les Arts i de les Ciencies, València",1.290.000€,2 hab.,134 m²,planta 19ª exterior con ascensor,Person Inmobiliaria,https://www.idealista.com/inmueble/107625511/,Garaje incluido
116,"Piso en avenida de Pius XII, Campanar, València",799.000€,6 hab.,245 m²,planta 3ª exterior con ascensor,CM PROPERTIES REAL ESTATE  VALENCIA,https://www.idealista.com/inmueble/107334940/,No incluye garaje
117,"Piso en calle dels Gremis, 7, Vara de Quart, València",195.000€,1 hab.,99 m²,bajo exterior con ascensor,Kasabiba,https://www.idealista.com/inmueble/105661071/,Garaje incluido
118,"Piso en calle de Montant, El Cabanyal-El Canyamelar, València",350.000€,3 hab.,76 m²,entreplanta exterior sin ascensor,LION CAPITAL GROUP,https://www.idealista.com/inmueble/107279410/,No incluye garaje
119,"Piso en avenida del Port, Aiora, València",315.000€,3 hab.,126 m²,planta 6ª exterior con ascensor,LION CAPITAL GROUP,https://www.idealista.com/inmueble/106702002/,No incluye garaje
120,"Ático en calle de l'Impressor Monfort, Patraix, València",390.000€,3 hab.,122 m²,planta 7ª exterior con ascensor,LION CAPITAL GROUP,https://www.idealista.com/inmueble/106637886/,Garaje incluido
121,"Piso en avenida de Blasco Ibáñez, Mestalla, València",340.000€,4 hab.,113 m²,planta 4ª exterior con ascensor,LION CAPITAL GROUP,https://www.idealista.com/inmueble/107567680/,No incluye garaje
122,"Piso en calle d' Alcàsser, Soternes, València",439.000€,3 hab.,116 m²,planta 6ª exterior con ascensor,LION CAPITAL GROUP,https://www.idealista.com/inmueble/107520597/,No incluye garaje
123,"Piso en calle de la Florista, Ciutat Fallera, València",180.000€,2 hab.,73 m²,bajo exterior sin ascensor,LION CAPITAL GROUP,https://www.idealista.com/inmueble/105306273/,No incluye garaje
124,"Piso en Carrea de Les Tres Forques, La Fontsanta, València",130.000€,3 hab.,67 m²,planta 4ª exterior sin ascensor,HogarAbitat,https://www.idealista.com/inmueble/107234345/,No incluye garaje
125,"Piso en calle de Ramon de Rocafull, El Cabanyal-El Canyamelar, València",289.000€,1 hab.,65 m²,planta 1ª exterior sin ascensor,LION CAPITAL GROUP,https://www.idealista.com/inmueble/107312511/,No incluye garaje
126,"Piso en calle de Joan Verdeguer, El Grau, València",260.000€,2 hab.,56 m²,planta 1ª interior con ascensor,LION CAPITAL GROUP,https://www.idealista.com/inmueble/107323503/,No incluye garaje
127,"Piso en calle de l'Arxiduc Carles, Patraix, València",337.000€,6 hab.,162 m²,planta 2ª exterior con ascensor,Llave maestra,https://www.idealista.com/inmueble/107324048/,No incluye garaje
128,"Piso en calle de Fontanars dels Alforins, Safranar, València",305.000€,3 hab.,102 m²,planta 1ª exterior con ascensor,Llave maestra,https://www.idealista.com/inmueble/107256482/,No incluye garaje
