ID,Título,Precio,Habitaciones,Metros cuadrados,Planta,Comercializado por,Link,Garaje
394,"Piso en La Raiosa, València",365.000€,3 hab.,76 m²,planta 6ª exterior con ascensor,aProperties Real Estate Valencia,https://www.idealista.com/inmueble/105962086/,No incluye garaje
395,"Estudio en Vara de Quart, València",195.000€,,90 m²,planta 2ª exterior con ascensor,aProperties Real Estate Valencia,https://www.idealista.com/inmueble/106333946/,Garaje incluido
396,"Estudio en Tormos, València",190.000€,,39 m²,bajo exterior sin ascensor,aProperties Real Estate Valencia,https://www.idealista.com/inmueble/105642939/,No incluye garaje
397,"Estudio en Vara de Quart, València",283.000€,,93 m²,planta 1ª exterior con ascensor,aProperties Real Estate Valencia,https://www.idealista.com/inmueble/106501496/,Garaje incluido
398,"Piso en calle de Masquefa, Camí de Vera, València",280.000€,4 hab.,105 m²,planta 5ª exterior con ascensor,Foro inmobiliario,https://www.idealista.com/inmueble/107700626/,No incluye garaje
399,"Piso en Exposició, València",520.000€,3 hab.,134 m²,planta 2ª exterior con ascensor,aProperties Real Estate Valencia,https://www.idealista.com/inmueble/107307455/,No incluye garaje
400,"Piso en Ciutat de les Arts i de les Ciencies, València",850.000€,3 hab.,186 m²,planta 14ª exterior con ascensor,aProperties Real Estate Valencia,https://www.idealista.com/inmueble/107334186/,Garaje incluido
401,"Piso en Morvedre, València",880.000€,3 hab.,239 m²,bajo exterior sin ascensor,aProperties Real Estate Valencia,https://www.idealista.com/inmueble/104277024/,No incluye garaje
402,"Piso en Patraix, València",410.000€,1 hab.,45 m²,bajo exterior sin ascensor,aProperties Real Estate Valencia,https://www.idealista.com/inmueble/105650536/,No incluye garaje
403,"Piso en Patraix, València",210.000€,1 hab.,55 m²,exterior sin ascensor,aProperties Real Estate Valencia,https://www.idealista.com/inmueble/105650512/,No incluye garaje
404,"Piso en Jaume Roig, València",450.000€,3 hab.,110 m²,planta 13ª exterior con ascensor,aProperties Real Estate Valencia,https://www.idealista.com/inmueble/107235472/,No incluye garaje
405,"Piso en calle de Lluís Oliag, Mont-Olivet, València",395.000€,2 hab.,102 m²,planta 2ª exterior con ascensor,Coldwell Banker Excellence Real Estate,https://www.idealista.com/inmueble/107444098/,No incluye garaje
406,"Piso en calle de la Fusta, Aiora, València",219.500€,1 hab.,47 m²,bajo exterior sin ascensor,LION CAPITAL GROUP,https://www.idealista.com/inmueble/106636523/,No incluye garaje
407,"Ático en calle de Jorge Juan, El Pla del Remei, València",3.000.000€,4 hab.,320 m²,planta 6ª exterior con ascensor,HELICE Inmobiliaria,https://www.idealista.com/inmueble/107325370/,Garaje opc. 60.000 €
408,"Piso en calle de la Democràcia, Soternes, València",195.000€,1 hab.,45 m²,exterior sin ascensor,aProperties Real Estate Valencia,https://www.idealista.com/inmueble/106891313/,No incluye garaje
409,"Piso en calle d'Archena, Soternes, València",249.000€,3 hab.,99 m²,planta 4ª exterior con ascensor,SPACES AND PLACES,https://www.idealista.com/inmueble/106617018/,No incluye garaje
410,"Piso en calle del Pintor Salvador Abril, Russafa, València",350.000€,2 hab.,77 m²,planta 4ª exterior con ascensor,MARTIN'S HOMES - Gestor de Propiedades,https://www.idealista.com/inmueble/107767849/,No incluye garaje
411,"Piso en calle de Pascual i Genís, Sant Francesc, València",1.300.000€,4 hab.,300 m²,planta 3ª exterior con ascensor,HELICE Inmobiliaria,https://www.idealista.com/inmueble/107271450/,No incluye garaje
412,"Ático en calle del Matemàtic Marzal, La Roqueta, València",298.000€,2 hab.,55 m²,planta 4ª exterior con ascensor,Cicerone Group,https://www.idealista.com/inmueble/106029148/,No incluye garaje
413,"Piso en calle del Comte d'Altea, Gran Vía, València",595.000€,4 hab.,112 m²,planta 3ª exterior con ascensor,Selección Inmobiliaria,https://www.idealista.com/inmueble/107822220/,No incluye garaje
414,"Piso en calle del Mestre Racional, Gran Vía, València",710.000€,3 hab.,132 m²,planta 5ª exterior con ascensor,Genteurbana,https://www.idealista.com/inmueble/107044788/,No incluye garaje
415,"Dúplex en calle de Menorca, Penya-Roja, València",850.000€,3 hab.,155 m²,planta 10ª exterior con ascensor,SPACES AND PLACES,https://www.idealista.com/inmueble/106063712/,Garaje incluido
416,"Piso en calle de Carrícola, La Creu Coberta, València",258.000€,3 hab.,80 m²,planta 2ª exterior con ascensor,JTM DREAMS,https://www.idealista.com/inmueble/107001016/,No incluye garaje
417,"Piso en calle del Pintor Genaro Lahuerta, 27, Trinitat, València",610.000€,4 hab.,175 m²,planta 6ª exterior con ascensor,RK Igarka,https://www.idealista.com/inmueble/106915653/,No incluye garaje
418,"Piso en calle de l'Organista Plasència, 51, En Corts, València",220.000€,3 hab.,75 m²,planta 3ª exterior sin ascensor,RK Igarka,https://www.idealista.com/inmueble/107560380/,No incluye garaje
419,"Piso en calle de la Democràcia, Nou Moles, València",250.000€,3 hab.,85 m²,planta 1ª exterior con ascensor,JTM DREAMS,https://www.idealista.com/inmueble/102783755/,No incluye garaje
420,"Ático en plaza d'Hondures, Ciutat Jardí, València",460.000€,3 hab.,113 m²,planta 14ª exterior con ascensor,Cicerone Group,https://www.idealista.com/inmueble/107490517/,No incluye garaje
421,"Ático en calle de Cavanilles, Jaume Roig, València",950.000€,4 hab.,275 m²,planta 8ª exterior con ascensor,Foro inmobiliario,https://www.idealista.com/inmueble/107521916/,Garaje incluido
422,"Piso en calle de Rodrigo de Pertegás, La Creu del Grau, València",175.007€,3 hab.,78 m²,planta 3ª exterior con ascensor,VIVALTA INMOBILIARIA,https://www.idealista.com/inmueble/107769811/,No incluye garaje
423,"Casa o chalet independiente en calle Major de Natzaret, Natzaret, València",650.000€,6 hab.,503 m²,,Rk Valencia Market,https://www.idealista.com/inmueble/104912178/,Garaje incluido
424,"Piso en calle d'Escalante, El Cabanyal-El Canyamelar, València",229.990€,3 hab.,84 m²,planta 2ª exterior con ascensor,Rk Valencia Market,https://www.idealista.com/inmueble/105178420/,No incluye garaje
425,"Piso en calle de Sant Domènec Savio, 33, Torrefiel, València",165.000€,1 hab.,44 m²,bajo exterior sin ascensor,My Blue Bricks,https://www.idealista.com/inmueble/107208128/,No incluye garaje
426,"Piso en avenida Gran Via del Marqués del Túria, Gran Vía, València",320.000€,3 hab.,84 m²,planta 7ª interior con ascensor,Gran Vía Inmobiliaria,https://www.idealista.com/inmueble/107093505/,No incluye garaje
427,"Piso en Patraix, València",260.000€,3 hab.,83 m²,planta 3ª interior con ascensor,donpiso,https://www.idealista.com/inmueble/107648699/,No incluye garaje
428,"Estudio en calle Andarella, Vara de Quart, València",195.000€,,70 m²,planta 3ª exterior con ascensor,Mocadi Real Estate,https://www.idealista.com/inmueble/105789708/,Garaje incluido
429,"Piso en calle del Marqués de Campo, La Raiosa, València",320.000€,3 hab.,95 m²,planta 5ª interior con ascensor,Olimpo Homes & Investment,https://www.idealista.com/inmueble/107435572/,No incluye garaje
430,"Piso en Benicalap, València",349.000€,4 hab.,145 m²,planta 5ª exterior con ascensor,QUALITY GESTION,https://www.idealista.com/inmueble/107109617/,No incluye garaje
431,"Piso en calle de Francesc Climent, La Raiosa, València",325.000€,3 hab.,102 m²,planta 7ª exterior con ascensor,MARTIN'S HOMES - Gestor de Propiedades,https://www.idealista.com/inmueble/107520292/,No incluye garaje
432,"Estudio en calle Andarella, Vara de Quart, València",189.000€,,70 m²,planta 2ª exterior con ascensor,Mocadi Real Estate,https://www.idealista.com/inmueble/105782202/,Garaje incluido
433,"Piso en calle del Mestre Sosa, Arrancapins, València",395.000€,2 hab.,82 m²,planta 5ª exterior con ascensor,MARTIN'S HOMES - Gestor de Propiedades,https://www.idealista.com/inmueble/107133254/,No incluye garaje
434,"Piso en calle del Comte de Salvatierra, El Pla del Remei, València",1.100.000€,6 hab.,241 m²,planta 3ª exterior con ascensor,PIRESA GESTIÓN,https://www.idealista.com/inmueble/107077122/,Garaje incluido
435,"Piso en calle de Jerónima Galés, L'Hort de Senabre, València",269.000€,3 hab.,136 m²,planta 4ª exterior con ascensor,PIRESA GESTIÓN,https://www.idealista.com/inmueble/107373794/,No incluye garaje
436,"Ático en calle de Just Ramírez, Tormos, València",570.000€,4 hab.,154 m²,planta 6ª exterior con ascensor,PIRESA GESTIÓN,https://www.idealista.com/inmueble/107153707/,Garaje incluido
437,"Casa o chalet independiente en calle del Comte de Torrefiel, Torrefiel, València",290.000€,3 hab.,101 m²,,Casas del Mediterráneo,https://www.idealista.com/inmueble/106424322/,No incluye garaje
438,"Piso en calle de Tirant lo Blanch, En Corts, València",249.000€,2 hab.,87 m²,planta 4ª exterior con ascensor,RK Igarka,https://www.idealista.com/inmueble/107148307/,No incluye garaje
439,"Piso en calle del Poeta Querol, Sant Francesc, València",1.350.000€,3 hab.,217 m²,planta 6ª exterior con ascensor,Galgo Real Estate Valencia,https://www.idealista.com/inmueble/107564552/,Garaje incluido
440,"Piso en calle de Lluís Oliag, Mont-Olivet, València",295.000€,3 hab.,83 m²,planta 4ª exterior con ascensor,RK Igarka,https://www.idealista.com/inmueble/106683557/,No incluye garaje
441,"Piso en calle D'Alberic, Arrancapins, València",690.000€,3 hab.,226 m²,bajo exterior sin ascensor,PINEDA LUXURY,https://www.idealista.com/inmueble/104818854/,No incluye garaje
442,"Piso en calle del Bon Orde, Arrancapins, València",515.000€,4 hab.,209 m²,planta 2ª exterior con ascensor,Llave maestra,https://www.idealista.com/inmueble/105866846/,No incluye garaje
443,"Ático en Gran Via del Marqués del Túria, El Pla del Remei, València",399.000€,1 hab.,95 m²,planta 8ª exterior con ascensor,Galgo Real Estate Valencia,https://www.idealista.com/inmueble/105819152/,No incluye garaje
444,"Piso en calle de Colón, El Pla del Remei, València",1.300.000€,4 hab.,184 m²,planta 2ª exterior con ascensor,Galgo Real Estate Valencia,https://www.idealista.com/inmueble/103365044/,No incluye garaje
445,"Piso en calle de Sant Joan de la Penya, 26, Els Orriols, València",120.000€,3 hab.,79 m²,planta 5ª exterior sin ascensor,Coral Casa Gestión Inmobiliaria,https://www.idealista.com/inmueble/105522350/,No incluye garaje
446,"Piso en calle de Guillem de Castro, El Botànic, València",207.000€,2 hab.,67 m²,planta 2ª exterior con ascensor,Particular o sin info,https://www.idealista.com/inmueble/106965733/,No incluye garaje
447,"Piso en avenida de Burjassot, El Calvari, València",215.000€,3 hab.,66 m²,planta 4ª interior con ascensor,Leader Real Estate,https://www.idealista.com/inmueble/107445660/,No incluye garaje
448,"Dúplex en Arrancapins, València",670.000€,4 hab.,166 m²,bajo exterior sin ascensor,Genteurbana,https://www.idealista.com/inmueble/107746783/,No incluye garaje
449,"Piso en Benicalap, València",220.000€,4 hab.,88 m²,planta 5ª exterior con ascensor,Percent Servicios Inmobiliarios,https://www.idealista.com/inmueble/107718163/,No incluye garaje
450,"Piso en calle del Comte de Salvatierra, El Pla del Remei, València",3.500.000€,4 hab.,350 m²,planta 7ª exterior con ascensor,Found Valencia Real Estate,https://www.idealista.com/inmueble/105973487/,No incluye garaje
451,"Piso en Russafa, València",359.900€,2 hab.,92 m²,planta 3ª exterior sin ascensor,Percent Servicios Inmobiliarios,https://www.idealista.com/inmueble/106085312/,No incluye garaje
452,"Piso en Morvedre, València",985.000€,16 hab.,375 m²,planta 1ª exterior con ascensor,Engel & Völkers València,https://www.idealista.com/inmueble/107160987/,No incluye garaje
453,"Casa o chalet independiente en calle d'Isabel de Villena, Playa de la Malvarrosa, València",1.400.000€,4 hab.,170 m²,,Voramar gestion inmobiliaria,https://www.idealista.com/inmueble/106176031/,Garaje incluido
454,"Piso en Benimaclet, València",495.000€,4 hab.,112 m²,planta 4ª exterior con ascensor,Percent Servicios Inmobiliarios,https://www.idealista.com/inmueble/107829927/,Garaje incluido
455,"Dúplex en Mestalla, València",2.200.000€,4 hab.,300 m²,planta 6ª exterior con ascensor,OC HABITAT,https://www.idealista.com/inmueble/107212226/,Garaje incluido
456,"Dúplex en El Botànic, València",750.000€,3 hab.,240 m²,bajo interior con ascensor,QUALITY GESTION,https://www.idealista.com/inmueble/103947122/,No incluye garaje
457,"Piso en La Punta, València",155.000€,1 hab.,57 m²,planta 2ª exterior con ascensor,Percent Servicios Inmobiliarios,https://www.idealista.com/inmueble/107074687/,No incluye garaje
458,"Piso en La Xerea, València",199.990€,2 hab.,48 m²,planta 1ª exterior sin ascensor,Amarilo Inmobiliaria,https://www.idealista.com/inmueble/105375099/,No incluye garaje
459,"Piso en Ciutat Jardí, València",490.000€,4 hab.,106 m²,planta 9ª exterior con ascensor,aProperties Real Estate Valencia,https://www.idealista.com/inmueble/107296323/,Garaje incluido
460,"Piso en avenida de la Malva-Rosa, Playa de la Malvarrosa, València",190.000€,3 hab.,75 m²,planta 3ª exterior sin ascensor,Jasmine Homes Valencia,https://www.idealista.com/inmueble/106726423/,No incluye garaje
461,"Ático en avenida de les Corts Valencianes, Benicalap, València",890.000€,3 hab.,200 m²,planta 15ª exterior con ascensor,K&N ELITE VALENCIA,https://www.idealista.com/inmueble/107623954/,Garaje incluido
462,"Ático en avenida del Professor López Piñero, Ciutat de les Arts i de les Ciencies, València",1.290.000€,2 hab.,136 m²,planta 19ª exterior con ascensor,K&N ELITE VALENCIA,https://www.idealista.com/inmueble/107690017/,Garaje incluido
463,"Piso en calle d'Abén al Abbar, 8, Albors, València",358.000€,4 hab.,100 m²,planta 7ª exterior con ascensor,Nestar Homes,https://www.idealista.com/inmueble/107321597/,Garaje incluido
464,"Piso en calle d'Abén al Abbar, 8, Albors, València",340.000€,4 hab.,96 m²,planta 1ª exterior con ascensor,Nestar Homes,https://www.idealista.com/inmueble/107288273/,Garaje incluido
465,"Piso en calle del Baró de Patraix, Patraix, València",180.000€,4 hab.,69 m²,planta 4ª exterior sin ascensor,SPACES AND PLACES,https://www.idealista.com/inmueble/107203661/,No incluye garaje
466,"Piso en calle de Sant Josep de Calassanç, Arrancapins, València",499.900€,3 hab.,115 m²,planta 1ª exterior con ascensor,medina&co,https://www.idealista.com/inmueble/106737225/,Garaje incluido
467,"Piso en calle de Colón, Sant Francesc, València",1.100.000€,5 hab.,274 m²,planta 4ª exterior con ascensor,QUALITY GESTION,https://www.idealista.com/inmueble/99703458/,Garaje incluido
468,"Piso en calle del Poeta Mas y Ros, Ciutat Jardí, València",380.000€,3 hab.,105 m²,planta 3ª exterior con ascensor,PINEDA LUXURY,https://www.idealista.com/inmueble/107739913/,No incluye garaje
469,"Piso en calle del General Palanca, La Xerea, València",780.000€,6 hab.,215 m²,planta 1ª exterior con ascensor,Selección Inmobiliaria,https://www.idealista.com/inmueble/103989729/,No incluye garaje
470,"Ático en calle de les Monges, El Mercat, València",360.000€,2 hab.,105 m²,planta 4ª exterior con ascensor,Particular o sin info,https://www.idealista.com/inmueble/107301182/,No incluye garaje
471,"Ático en avenida del Professor López Piñero, Ciutat de les Arts i de les Ciencies, València",1.290.000€,2 hab.,134 m²,planta 19ª exterior con ascensor,Grupo Hogares - Oficina Camins Al Grau,https://www.idealista.com/inmueble/107627263/,Garaje incluido
472,"Piso en El Cabanyal-El Canyamelar, València",260.000€,2 hab.,80 m²,exterior sin ascensor,Voramar gestion inmobiliaria,https://www.idealista.com/inmueble/101357711/,No incluye garaje
473,"Piso en avenida del Cid, Nou Moles, València",200.000€,3 hab.,72 m²,planta 8ª interior con ascensor,Gran Vía Inmobiliaria,https://www.idealista.com/inmueble/107517556/,No incluye garaje
474,"Piso en El Carme, València",285.000€,1 hab.,35 m²,bajo exterior con ascensor,Grupo90 inmobiliarias,https://www.idealista.com/inmueble/107829064/,No incluye garaje
475,"Piso en Morvedre, València",499.000€,3 hab.,154 m²,planta 6ª exterior con ascensor,Grupo90 inmobiliarias,https://www.idealista.com/inmueble/107631140/,Garaje incluido
476,"Piso en Morvedre, València",380.000€,1 hab.,75 m²,bajo exterior con ascensor,Grupo90 inmobiliarias,https://www.idealista.com/inmueble/107711652/,No incluye garaje
477,"Piso en Músic Peydró, El Mercat, València",450.000€,3 hab.,80 m²,planta 2ª exterior sin ascensor,Particular o sin info,https://www.idealista.com/inmueble/103203578/,No incluye garaje
478,"Ático en Tormos, València",570.000€,4 hab.,154 m²,planta 6ª exterior con ascensor,Habitale Mestalla,https://www.idealista.com/inmueble/107154393/,Garaje incluido
479,"Ático en El Mercat, València",374.500€,2 hab.,105 m²,planta 4ª exterior con ascensor,Percent Servicios Inmobiliarios,https://www.idealista.com/inmueble/107362689/,No incluye garaje
480,"Ático en Ciutat de les Arts i de les Ciencies, València",695.000€,4 hab.,200 m²,planta 9ª exterior con ascensor,Villamed Luxury Homes,https://www.idealista.com/inmueble/105234966/,Garaje incluido
481,"Piso en Benicalap, València",160.000€,2 hab.,58 m²,planta 3ª exterior sin ascensor,Grupo90 inmobiliarias,https://www.idealista.com/inmueble/107682541/,No incluye garaje
482,"Piso en Campanar, València",560.000€,3 hab.,110 m²,planta 8ª exterior con ascensor,Grupo90 inmobiliarias,https://www.idealista.com/inmueble/107837194/,No incluye garaje
483,"Piso en Les Tendetes, València",309.000€,6 hab.,110 m²,bajo exterior sin ascensor,Grupo90 inmobiliarias,https://www.idealista.com/inmueble/107833621/,No incluye garaje
484,"Piso en Torrefiel, València",349.000€,4 hab.,116 m²,planta 1ª exterior con ascensor,Grupo90 inmobiliarias,https://www.idealista.com/inmueble/103375062/,No incluye garaje
485,"Piso en La Xerea, València",350.000€,1 hab.,71 m²,planta 2ª exterior sin ascensor,Grupo90 inmobiliarias,https://www.idealista.com/inmueble/107358716/,No incluye garaje
486,"Piso en Torrefiel, València",260.000€,7 hab.,167 m²,bajo interior sin ascensor,Grupo90 inmobiliarias,https://www.idealista.com/inmueble/106788077/,No incluye garaje
487,"Piso en calle de Sevilla, Russafa, València",425.000€,3 hab.,109 m²,planta 1ª exterior con ascensor,Particular o sin info,https://www.idealista.com/inmueble/107239231/,No incluye garaje
488,"Piso en calle del Brasil, Nou Moles, València",269.900€,4 hab.,125 m²,planta 1ª exterior con ascensor,medina&co,https://www.idealista.com/inmueble/107518965/,No incluye garaje
489,"Piso en L'Amistat, València",185.000€,2 hab.,66 m²,planta 1ª exterior sin ascensor,Grupo90 inmobiliarias,https://www.idealista.com/inmueble/107645798/,No incluye garaje
490,"Piso en calle del General Elio, Exposició, València",1.400.000€,4 hab.,216 m²,planta 2ª exterior con ascensor,Foro inmobiliario,https://www.idealista.com/inmueble/107282117/,Garaje incluido
491,"Piso en calle de Granada, Mont-Olivet, València",330.000€,3 hab.,123 m²,planta 3ª exterior con ascensor,Gran Vía Inmobiliaria,https://www.idealista.com/inmueble/107755993/,No incluye garaje
492,"Piso en avenida de Peris i Valero, Russafa, València",350.000€,3 hab.,95 m²,planta 4ª exterior con ascensor,Gran Vía Inmobiliaria,https://www.idealista.com/inmueble/107599589/,No incluye garaje
493,"Piso en La Petxina, València",600.000€,6 hab.,220 m²,planta 1ª exterior con ascensor,Llave maestra,https://www.idealista.com/inmueble/107492213/,No incluye garaje
494,"Piso en La Creu Coberta, València",315.000€,3 hab.,117 m²,planta 6ª exterior con ascensor,Particular o sin info,https://www.idealista.com/inmueble/107018542/,No incluye garaje
495,"Ático en La Raiosa, València",330.000€,2 hab.,73 m²,planta 1ª exterior con ascensor,Selección Inmobiliaria,https://www.idealista.com/inmueble/107608506/,No incluye garaje
496,"Piso en Sant Llorenç, València",85.500€,3 hab.,68 m²,planta 3ª,Particular o sin info,https://www.idealista.com/inmueble/101936678/,No incluye garaje
497,"Piso en Penya-Roja, València",135.000€,3 hab.,70 m²,planta 1ª,Particular o sin info,https://www.idealista.com/inmueble/100616929/,No incluye garaje
498,"Piso en En Corts, València",245.000€,1 hab.,70 m²,bajo exterior con ascensor,Grupo90 inmobiliarias,https://www.idealista.com/inmueble/106053233/,No incluye garaje
499,"Piso en Aiora, València",250.000€,2 hab.,90 m²,bajo exterior sin ascensor,Grupo90 inmobiliarias,https://www.idealista.com/inmueble/105656203/,No incluye garaje
500,"Piso en Gran Vía, València",340.000€,3 hab.,90 m²,planta 7ª interior con ascensor,Grupo90 inmobiliarias,https://www.idealista.com/inmueble/106798224/,No incluye garaje
501,"Piso en Aiora, València",490.000€,3 hab.,212 m²,planta 1ª exterior con ascensor,Grupo Hogares - Oficina Camins Al Grau,https://www.idealista.com/inmueble/107552842/,Garaje incluido
502,"Piso en Nou Moles, València",335.000€,3 hab.,128 m²,planta 2ª exterior con ascensor,Particular o sin info,https://www.idealista.com/inmueble/105869876/,Garaje incluido
503,"Piso en calle de Sueca, Russafa, València",565.000€,3 hab.,110 m²,planta 5ª exterior con ascensor,Huspy Valencia,https://www.idealista.com/inmueble/106828196/,No incluye garaje
504,"Piso en calle de Sueca, Russafa, València",535.000€,3 hab.,135 m²,planta 3ª exterior con ascensor,OC HABITAT,https://www.idealista.com/inmueble/106789408/,No incluye garaje
505,"Piso en calle de Sant Francesc de Borja, Arrancapins, València",275.000€,2 hab.,85 m²,planta 4ª exterior sin ascensor,CM PROPERTIES REAL ESTATE  VALENCIA,https://www.idealista.com/inmueble/107722802/,No incluye garaje
506,"Piso en vicente Blasco Ibañez, Ciutat Jardí, València",335.000€,3 hab.,110 m²,planta 11ª exterior con ascensor,TUMIKASA,https://www.idealista.com/inmueble/94636233/,No incluye garaje
507,"Casa o chalet independiente en calle de Bernat I Baldoví, Jaume Roig, València",2.200.000€,4 hab.,244 m²,,OC HABITAT,https://www.idealista.com/inmueble/106349103/,Garaje incluido
508,"Piso en calle de la Reina, El Cabanyal-El Canyamelar, València",387.000€,3 hab.,101 m²,planta 3ª exterior con ascensor,Inmobiliaria serrería,https://www.idealista.com/inmueble/106237054/,No incluye garaje
509,"Piso en calle de Sueca, Russafa, València",400.000€,2 hab.,70 m²,planta 4ª exterior con ascensor,Pilar Fuster Inmobiliaria,https://www.idealista.com/inmueble/107511185/,No incluye garaje
510,"Dúplex en calle del Bomber Ramon Duart, Ciutat de les Arts i de les Ciencies, València",500.000€,2 hab.,158 m²,bajo exterior con ascensor,Pilar Fuster Inmobiliaria,https://www.idealista.com/inmueble/107606940/,Garaje incluido
511,"Piso en avenida del Regne de València, Gran Vía, València",1.200.000€,4 hab.,202 m²,planta 5ª exterior con ascensor,Pilar Fuster Inmobiliaria,https://www.idealista.com/inmueble/105419418/,No incluye garaje
512,"Piso en Colon, El Pla del Remei, València",995.000€,5 hab.,269 m²,planta 2ª exterior con ascensor,Desirée Hato gestion de inmuebles,https://www.idealista.com/inmueble/91600437/,Garaje incluido
513,"Piso en Maestro Clave, El Mercat, València",365.000€,2 hab.,97 m²,planta 1ª exterior con ascensor,Desirée Hato gestion de inmuebles,https://www.idealista.com/inmueble/104030971/,No incluye garaje
514,"Dúplex en calle del Mestre Gozalbo, Gran Vía, València",1.000.000€,4 hab.,200 m²,planta 5ª exterior con ascensor,Pilar Fuster Inmobiliaria,https://www.idealista.com/inmueble/107357097/,No incluye garaje
515,"Piso en Pio XII, Campanar, València",295.000€,4 hab.,138 m²,planta 1ª exterior con ascensor,Gestión Fácil,https://www.idealista.com/inmueble/106027448/,No incluye garaje
516,"Piso en calle de Guillem de Castro, El Pilar, València",550.000€,4 hab.,133 m²,planta 8ª exterior con ascensor,Desirée Hato gestion de inmuebles,https://www.idealista.com/inmueble/106688561/,Garaje opc. 50.000 €
517,"Piso en Gran Vía, València",595.000€,6 hab.,175 m²,planta 1ª exterior con ascensor,Solid Inmuebles,https://www.idealista.com/inmueble/107207849/,No incluye garaje
518,"Chalet pareado en calle d'Isabel de Villena, Playa de la Malvarrosa, València",798.000€,4 hab.,326 m²,,Engel & Völkers València,https://www.idealista.com/inmueble/99972502/,Garaje incluido
519,"Piso en calle de Guillem de Castro, La Roqueta, València",600.000€,5 hab.,209 m²,planta 8ª exterior con ascensor,ILIOS Real Estate,https://www.idealista.com/inmueble/106967558/,No incluye garaje
520,"Piso en calle de Sant Vicent Màrtir, Sant Francesc, València",1.250.000€,4 hab.,273 m²,planta 6ª exterior con ascensor,ILIOS Real Estate,https://www.idealista.com/inmueble/100645719/,No incluye garaje
521,"Piso en calle del Duc de Mandas, Sant Llorenç, València",425.000€,2 hab.,96 m²,planta 1ª exterior con ascensor,ILIOS Real Estate,https://www.idealista.com/inmueble/107425411/,Garaje incluido
522,"Piso en calle del Convent de Jerusalem, La Roqueta, València",219.990€,2 hab.,48 m²,planta 3ª exterior sin ascensor,ILIOS Real Estate,https://www.idealista.com/inmueble/105841227/,Garaje opc. 110 €
523,"Piso en calle de Pascual i Genís, Sant Francesc, València",645.000€,2 hab.,107 m²,planta 4ª exterior con ascensor,Desirée Hato gestion de inmuebles,https://www.idealista.com/inmueble/107244233/,No incluye garaje
524,"Piso en calle del Pintor Salvador Abril, Russafa, València",400.000€,3 hab.,125 m²,planta 2ª exterior con ascensor,OC HABITAT,https://www.idealista.com/inmueble/102869568/,No incluye garaje
